Text	Theme
"Environmental complianceWe improved our rate of conformity with our site environmental standards for the third-year running to 90.6%. Going forward, we will update our existing environmental standards, create new ones where required and produce more educational videos to support our employees in their learning and understanding"	Natural
We have continued to put effort into producing effective training and communications and this year produced our first ever educational video about the correct management of diesel  storage areas. The footage was professionally filmed on our own site featuring our own staff and contractors	Human
	
"Being a partner of choiceWe partner with many local authorities, the HCA and several private sector vendors on an open book and transparent basis. For example: ■ Longcross near Chobham, Surrey was acquired as part of a 50/50 joint venture with Aviva, our funding partner. This 300-acre former Defence Evaluation and Research Agency site was first constructed during and immediately after the Second World War and is sensitively set in the greenbelt. The northern part of the site was granted consent in 2014 for the first 200 well-designed homes and a significant new business park of one million square feet. Taken together with the southern site, which is now within the emerging draft core strategy, Longcross offers the Group the opportunity to drive significant business value in the years to come"	Intellectual
"We said  we would...We did... Key priorities from our last report    Be a partner of choice for landowners, public sector agencies and others.             Develop true partnering arrangements to secure materials and labour, and  raise quality.     Continue to focus on sourcing certified timber"	Social_Relationship
Continued to partner with many public and private sector stakeholders	Social_Relationship
Bringing sites forward Procurement Build quality Responsible sourcingRolled out new Quality Manual and reinforced inspection procedure.  Long-term trading arrangements in place with key suppliers. Launched a three- year action plan for timber sourcing.	Social_Relationship
	
"We continue in our role as development managers for the redevelopment of the 2,000-home Arborfield Garrison, having been selected by the Defence Infrastructure Organisation (DIO"	Manufactured
"During the year we were also selected by the DIO as development manager for Wyton Airfield, Cambridgeshire, to deliver a new town of 4,500 homes including open market, Ministry of Defence and private rental housing. ■ The Group remains an approved partner on the HCA’s Delivery Partner Panel in all our principal operating areas outside the centre  of London.Recognising that larger sites can be exposed to macro-economic fluctuations, the Group has developed commercial models that help to share risk with the land vendor, in exchange for sharing some of the upside potential from a development. As a result we secure meaningful proportions of our land from our strategic land portfolio (44%), from the public sector (c.18%),"	Unclassified
"and from private vendors in ‘one-to-one’ negotiations (c.15%). As a consequence of this strategy, the Group is typically acquiring only  20 to 25% of its land through multi-party, open-market competitive tenders.The blend of land sources and the different commercial approaches adopted mean that the business enjoys the benefit of control over a  6.8-year short-term land pipeline, but is also able to deliver strong returns"	Financial
"Supply chain risk and opportunityFollowing the economic downturn of six years ago, the construction sector lost about half its capacity and a quarter of a million construction jobs. House building has also undergone rapid technical change, including evolving regulation for energy and carbon performance, and a proliferation of housing standards that vary  by locality. While some factors such as continually shifting regulations are outside its control, the construction industry has been slow to adapt to"	Natural
	
"change and investment in innovation has been low. With our subcontractors and suppliers, we are working hard to address a number of industry-wide issues, looking particularly at how we secure our supply of labour and materials; improve build quality; reduce the potential for defects; and improve efficiency.With knowledge gained working for the ZCH on the design versus as-built (DvAB) evidence gathering project, we are very well placed to address many of the challenges the industry faces in delivering an excellent standard of  new homes."	Intellectual
"Genuine partneringWe aim to become the developer of choice for subcontractors and suppliers, and this is a key strand of our supply chain workstream, which began towards the end of 2014. We are looking at how we can partner with the supply chain, including mutually beneficial procedures, payment terms and contractual arrangements. We have already been managing current risks by working closely with select subcontractors to strengthen relationships and secure essential services. Group-wide framework agreements are in place for key materials to guarantee a quantity of supply and we are planning 12 months ahead with suppliers of bricks and blocks"	Unclassified
"With other key materials such as roof trusses, joists, stairs and ventilation, we are bringing suppliers into the design process earlier  and are also looking to build longer term strategic alliances with key subcontractors  and suppliers"	Social_Relationship
"We are also exploring how off-site manufacture may be able to assist in delivering larger components to reduce the reliance on site-level skills and the potential impact of bad weather.  In turn, this will assist in delivering the right quality, on time, which not only benefits Crest Nicholson and its customers but also means that the trades will receive regular work to an agreed schedule"	Unclassified
"ubcontracted work has been particularly volatile this year and to create more stability we have been going individually to key suppliers at a local level, and engaging them very early in agreements designed to drive quality and value for both sides"	Unclassified
"he AIMC4 project is a prime example of innovative partnering: the consortium members, including Crest Nicholson, have delivered low carbon, fabric first homes through a groundbreaking process of supplier engagement and lean construction"	Intellectual
mproving build quality and standards Current construction methods are very reliant on labour and skills and involve many components that are assembled on site. Over the long term we are considering innovative methods and materials that can reduce this complexity but in the meantime we are focused on raising build quality by defining and communicating our standards and ensuring these are met	Unclassified
"This year we launched the Crest Nicholson Quality Manual and a strengthened inspection and sign-off procedure for build stages. The manual sets out our benchmark quality standard – and ‘Gold Standards’ – for workmanship and materials, and is concise and pictorial, with clear notes for specific trades and subcontractors. The content focuses on the pitfalls affecting build quality and finish to help site teams identify issues contributing to the DvAB performance gap."	Unclassified
"The Quality Manual is sent to all subcontractors at tender stage so that returns are priced against the workmanship standards it sets out. It is then used by the site management team during inspections and as a benchmark when signing off each stage of the build.   For further details of how we are supporting and developing technical skills across the Group,  see page 43."	Unclassified
	
"Low carbon design and constructionAs a member of the AIMC4 consortium supported by the Government’s Technology Strategy Board, we have been pioneering the volume production of low carbon homes. We are now building on what we have learned in readiness for the next steps on the zero carbon journey"	Natural
"A key goal of AIMC4 was to meet Code level 4 energy requirements through fabric and building services solutions only (without the use of renewables). This means that the carbon savings delivered are mainly in the fabric of the home – in effect, for the life of the building and not just the life of a technology or componen"	Intellectual
"The experience of delivering our five AIMC4 homes at Noble Park confirms that skills in low carbon design and build are scarce among trades and contractors. It also confirms our strategy of continuous learning so that our own teams are well equipped for procuring, specifying and delivering innovative new homes"	Natural
"Full details of the project outcomes and  learning can be found at: www.aimc4.com but there are a number of areas that the Group, in partnership with the consortium and suppliers, is taking forwar"	Unclassified
"Going forward, the Government’s zero carbon requirements are still evolving but Crest Nicholson is well placed to respond. We will continue to focus on building fabric first homes to meet the higher reaches of energy requirements, while also looking to complement this approach using green energy solutions, such as photovoltaic where relevan"	Natural
"Adapting designs for a changing climateA highly insulated building envelope may bring a risk of occasional discomfort during the hottest weather if this is not considered at the design stage. We have continued to assess the overheating risk through dynamic heating analysis on some sites then changing the solar transmission of glazing, introducing solar shading and carrying out other adjustments. Our evaluation of our AIMC4 homes (see page 39) is evidence that we are getting the balance right, with the data showing that the AIMC4 customers were very satisfied and comfortable living in their homes during all season"	Natural
"Workmanship, skills and knowledge ‘Traditional’ house building follows many principles from the Victorian era, restricting the efficient delivery of innovative homes. Common practices among contractors such as substituting materials can contribute to the performance gap and affect quality. Education and training both internally and with suppliers. Quality Manual developed as a ‘how to build well’ foundation guide for trades and contractors"	Unclassified
Benchmark inspections focused on quality and correct build.We are also looking at a range of innovative methods and materials to take house building forward.	Intellectual
Cost challenges  The AIMC4 homes can be delivered in thin joint masonry and open panel timber frame at relatively low volume and at an extra-over cost (compared to a 2009 Code 3 home) but there is potential to reduce costs further over time through volume delivery and lean construction	Unclassified
Technical design innovation Delivering a highly insulated wall does not increase its thickness significantly but a high quality wall that is easily repeatable and commercially viable is a major challenge for a fabric first solution. Off-site manufacture may hold the key.	Intellectual
	
Responsible procurementOur Sustainable Procurement Policy sets out our commitment to specify sustainable materials and work with our supply chain to promote social responsibility and  environmental stewardship	Natural
"Timber is a key material and, in 2013, 82% of our directly supplied timber was verified as coming from well-managed, certified sources (FSC or PEFC), compared to 98% the previous year. An ongoing challenge is that we do not have the same visibility when it comes to contractors’ use of timber.  We have put in place a three-year action plan, including stretching targets for the percentage of FSC-certified timber procured through both our supply chain and contractors."	Unclassified
"What’s been deliveredHaving delivered 1,281 new homes to date, 25% of which have been affordable, the project has been, and continues to be, a resounding success. Kevin Roach, Director of Regeneration Services for Optima Community Association, says: “Park Central is a model of high quality and creative design-led redevelopment that"	Intellectual
"has created a vibrant and friendly community. The community aspect is important to Optima and the council. Crest Nicholson has supported this ambition throughout the life of the redevelopment by funding community activities and involving our residents in the process.”  Zareena Ahmed-Shere, Development Project Manager for Birmingham City Council, says: “Park Central’s tremendous success is attributable to the close collaboration, cooperation and commitment of all three project partners. In line with the project’s vision, the area is transformed beyond recognition. Once a crime-ridden estate, Park Central is now a thriving community that residents are able to take pride in. Crest Nicholson’s latest addition, Central Plaza, carries forth the stunning architecture, with panoramic views over ‘Moonlit’ and ‘Sunset’ neighbourhood parks."	Social_Relationship
"Through our supply chain workstream we’re looking at risks and opportunities related to capacity and innovation. These include the impact of regulation on design, components and material; the availability of materials and non-traditional alternatives; consideration of alternative construction methods to improve delivery and reduce risk; and teaming with strategic supply chain partners on product development."	Intellectual
	
"Average open-market selling price (£k)£287k 250 287230    2012  2013  2014Sales revenue (£m)£636.3m525.7 636.3408.0    2012  2013  2014Return on average  capital employed (%)26.0% 24.1*20.7 26.0    2012  2013  2014Basic earnings per share (pence)39.3p 29.4* 39.3N/A    2012  2013  2014Units completed2,530 2,172 2,5301,882    2012  2013  2014 Operating profit (£m)£128.1m97.1* 128.173.3    2012  2013  2014 Land pipeline g"	Financial
	
umber of apprenticesNumber of graduate	Human
per employeeReduction in Annual Injury Incidence Rate** (%	Human
"Customer service  (independent rating) Construction waste diverted from landfill (%)Sites with ecological enhancement or protectionHomes built on brownfield land (%) Certified timber sourced*** (%)BREEAM Green  Guide RatingPeople who would recommend Crest Nicholson to a friend (independent survey) Responsible resource management Partnership and supply chainDelivering to customers and communities 379/10 72%37 Available March 201595%4 95 953278 829/10 55 94 7282 989/109/10 **Compared to 2008 baseline.***Percentage of directly procured, credibly certified (FSC preferred).All elements in Crest Nicholson’s National Construction specification achieve a rating of C or above, with the exception of one (of three) specifications for a separating floor. Roof, external walls, windows and insulation specifications achieve either A or A+ ratings. Green Guide Rating not assessed prior to 201"	Social_Relationship
	
	
Stephen Stone Chief Executive3   Patrick Bergin Group Finance Director7   Chris Tinker Regeneration Chairman 8   Steve Evans Group Production Director9   Robin Hoyles Group Land and  Planning Director10  Kevin Maguire Group Company Secretar	Unclassified
"William Rucker Non-Executive Chairman2   Stephen Stone Chief Executive3   Patrick Bergin Group Finance Director 4   Pam Alexander, OBE Independent Non-Executive Director5   Malcolm McCaig Independent Non-Executive Director6   Jim Pettigrew Senior Independent  Non-Executive Directo"	Unclassified
	
"overnance structureOur governance framework allows informed and balanced discussions by senior management that take account of economic, social and environmental factors. All divisions operate through their own local management boards, each of which is accountable to the Executive Management Team. Group policies are reviewed by the Board and Executive Management Team as required to ensure currency and focus. Performance-linked remunerationOur policy is based on clear and simple market-competitive remuneration and incentive schemes with straightforward, reasonable metrics and performance criteria. Bonuses are linked to relevant financial and non-financial metrics and share-based schemes are linked to shareholder growth and return"	Unclassified
"The non-financial performance metric relates to customer satisfaction results and represents 15% of the Executive Director’s bonus. The Remuneration Committee continues to keep policy and structures attuned to the business strategy and aligned to the objectives of shareholders. For the full report of the Remuneration Committee, see page 83."	Unclassified
"thics and complianceThe house building industry is a highly regulated sector covered by a wide range of legislation in planning, construction, buildings performance, advertising, marketing, health and safety, and environmental management. We always look to exceed the minimum standards of compliance required by regulations and provide regular disclosure of financial and non-financial performance"	Unclassified
"s a responsible employer, we operate a range of ethical and equal treatment policies, and operate a whistleblowing policy enabling employees to report any concerns in confidence"	Human
Business Improvement Workgroups:Commercial Sales and Marketing TechnicalCustomer Service Sustainabilit	Social_Relationship
	
"Principal risks and uncertaintiesRisk management overviewThe aim of risk management is to identify and document all inherent risks that could affect the achievement of our objectives. Risk management is a regular focus for all parts of the business with the emphasis on continuous improvement. In the regional divisions, each divisional management board undertakes a regular assessment of its exposure to financial, operational and strategic risks and the measures that have been put in place to manage those risks. Risks are initially reported through the  divisional board and subsequently incorporated into the Group risk matrix. Each risk is classified and prioritised for further attention using  the approved risk acceptance thresholds  and categories.Significant risks arising from divisional assessments are monitored by the Executive Management Team, the Audit and Risk Committee and the Board"	Unclassified
	
Exposure to economic impacts arising from: a reduction in the Government’s stimulus package; residual Eurozone issues; geo-political events Higher unemployment or fear of unemployment undermines consumer confidence and reduces propensity to purchase a new home Managed growth of  the business  Maintain review of economic and political environment and consider potential responses to changes in trading conditions Board	Unclassified
"Build cost inflation Increased build costs, stimulated by rising activity, are disproportionate to changes in sale pricesSuppliers seek to ‘price in’ sales price inflation Managed growth of  the business  Significant work packages subject to comprehensive tender process and reviewDialogue with suppliers and subcontractors to highlight benefits of volume, certainty and prompt payment, as well as price Executive Management Team/Group Production Director"	Unclassified
"Land cost inflation Increased land costs, stimulated by rising activity, are disproportionate to changes in sale pricesLand vendors seek to ‘price in’ sales price inflation"	Financial
Managed growth of  the business  Long land pipeline reduces pressure to buy sitesApply Group hurdle rates to investment decisions Board/ Executive Management Team/Group Land and Planning Directo	Unclassified
"Rapid and extensive changes to planning system introduce uncertainty, delays and potential challenges to viable development"	Unclassified
Principles of ‘localism’ in planning matters encourage challenge and resistance to development. Central government responds only when impact on delivery  becomes apparent Managed growth of  the business Work closely with key regulators and decision- makers to establish  key principles to be  consistently upheldIncorporate planning uncertainties into assessment of land opportunities Executive Management Team	Unclassified
"The table summarises current areas of focus identified by the Board. For further details of risk management controls and procedures, see the Corporate governance section, page 67."	Unclassified
	
"elp to Buy incentive scheme removed or scaled back Removal of Help to Buy could lead to  volume reduction of 10–15% Reduced overall mortgage access impacts demand, sales values and rates of sale, and undermines confidence in the market Managed growth of  the business Alternative incentives available, though less compellingMaintain policymaker awareness of construction sector economic contribution Encourage lender community to focus on credit-worthinessContinue to develop alternative volume optionsContinue sales training to prepare for a tougher market in due course Executive Management Team"	Unclassified
"Reputational damage arising from a major product failure or significant environmental  or health and  safety issue Injury to persons, potential loss of lifeSerious damage to sites and/or environment, with consequential reputational damage and costs Delivering to customers and communities Board leadership and scrutiny of health, safety and environmen"	Social_Relationship
Assess risks and integrate them into management processes from pre-acquisition stageDedicated teams in place with comprehensive procedures  and controls	Intellectual
"ecruitment and retention of staff  with requisite skills more difficult in competitive market Shortages of key staff in critical business areas introduces cost and  delay in bringing developments forward Skills and leadership Ensure that the Group is a desirable employer, offering competitive packages,  career progression and  strong training and development processes Executive Management Team"	Human
Extreme weather events adversely impact developments and delivery Changes in weather patterns adversely impact deliverability of sitesRemedial solutions costlyDelivery delay Responsible resource management Consider extreme  weather impacts when designing productEnhance landscaping and mitigation measures to address consequences of extreme weather Executive Management Team	Intellectual
"Supply of materials and/or labour fails to match desired production levels Supply chain issues constrain output and efficiency in currently strong marketAdverse customer experience as build completion forecasting  is  difficult and subject  to variation Partnership and supply chain Dialogue with major suppliersAdvance planning and call-off by DivisionsExamine alternative production approaches, e.g. timber frame as opposed to blocksMaintain strong apprenticeship programme Group Production Director"	Social_Relationship
	
"St Peters Place, Hammersmith, London combines classically inspired architecture with the highest quality modern craftsmanshi"	Unclassified
	
"ading performance in the year ended  31st October 2014 has been very strong. Having returned to the public markets in the early part of 2013, the Group set an initial target of increasing housing outputs to more than 2,500 homes per year. This milestone has been reached in a shorter timeframe than envisaged, with housing unit completions for the year of 2,530 (2013: 2,172), representing growth of  16.5% over the prior year."	Financial
"ales revenues of £636.3m were 21% higher than the prior year, driven by increases in housing revenue. Generally improving economic conditions and improved mortgage access have underpinned a sustained recovery in the housing market, with reservations under the Government’s Help to Buy scheme continuing to represent an important source of demand"	Financial
"Contributions to turnover from land sales and commercial mixed use continue to comprise a small part of overall operations, together accounting for £32.4m of sales (2013: £34.5m). Commercial activity primarily related to the construction of a superstore for Morrisons  on our Centenary Quay regeneration site  in Southampton."	Financial
"Sales price gains in a number of locations have generated additional margin, albeit that some of this benefit is shared with land vendors, including the public sector. Build costs continue to show some measure of price appreciation, particularly wage rates for comparatively  scarce skilled trades such as bricklaying.Gross margins for the year were 28.6% (2013: 26.9%), reflecting the net benefit enjoyed by the business from sales price inflation in excess of cost inflation, and the impact of the rising number of plots that have been sourced through the strategic land portfolio"	Financial
"Operating profits of £128.1m (2013: £97.1m before exceptional costs) were 32% higher than the prior year and operating margins, at 20.1% (2013: 18.5%), reflect the improvement in gross margins. Operating profits at this level are the highest that the Group has reported and provide an excellent foundation for continued investment in housing delivery"	Financial
"Finance expense and taxationNet financing expense of £11.4m (2013: £10.3m) is £1.1m higher, primarily due to the accelerated amortisation of arrangement fees from prior financing arrangements as part of a refinancing package in March 2014"	Financial
"ncome tax expense in the year of £17.9m (2013: £15.3m) primarily reflected deferred tax arising from the reversal of temporary differences in the year. The effective tax rate for the year was lower than the standard rate of UK Corporation Tax, in part due to the recognition of previously unrecognised temporary difference"	Unclassified
"Earnings per shareBasic earnings per share have risen 34% to  39.3 pence from 29.4 pence in 2013, on a pre-exceptional basis. Full details are shown in Note 9 to the financial statements, on page 122"	Financial
