Text	Theme
"Our Remuneration Policy was approved by shareholders at the AGM in May 2014. The Policy provides a framework to support robust governance in line with the Group’s risk appetite and aligned with the Group’s business strategy, objectives, values and long-term interests, as well as the consideration of our Codes of Responsibility and the Helping Britain Prosper Plan"	Social_Relationship
s	Social_Relationship
"Financial inclusion and educationAs a bank that is committed to helping Britain prosper, we want to do more to champion financial inclusion, by focusing on five themes: accessible products and services that meet customers’ needs; improving people’s capability and confidence; working in partnership; investing in financial education; and supporting customers in financial difficulty that might be excluded from financial service"	Unclassified
"For many customers, helping them to open a basic bank account is the first step away from financial exclusion and into better money management. In 2014, we provided 269,000 new basic bank accounts and also helped 126,000 customers upgrade from basic to more mainstream products. You can read more about financial inclusion and financial education online"	Unclassified
Engaging colleaguesWe have regular dialogue with colleagues to get a picture of how they are feeling and keep them informed of changes to our business and our financial performance. We are committed to providing colleagues with comprehensive coverage of the economic and financial issues affecting the Group. Information is provided through various channels and views are represented through regular dialogue and consultation with the Unions. We offer share schemes to colleagues to encourage their financial involvement.	Unclassified
"n 2014, our annual Colleague Survey achieved its highest response rate to date, with 85 per cent of colleagues participating compared to 76 per cent in 2013. The Employee Engagement Index (EEI) and the Performance Excellence Index (PEI) measure individual motivation and how strongly colleagues believe we are committed to improving customer service, respectively. The Line Manager Index (LMI) shows how our colleagues feel about their line managers. Key feedback included:"	Human
	
"COMMUNITY Through our high street brands, we’re an integral part of communities across Britain. We believe we can make our greatest contribution to society by helping Britain’s communities to prosper."	Social_Relationship
"Community investment highlights – £16.5 million donated to the Lloyds Bank and Bank of Scotland Foundations; – £6.5 million raised since 2013 for our Charity of the year, the Alzheimer’s Society and Alzheimer Scotland against our £4 million target; – 1,632 grants to community groups through our Community Fund; – 37,847 colleagues volunteered through our Day to Make a Difference programme; – 4.83 million local people brought together through The Big Lunch,  of which Halifax is a partner; – 2,607 nominations for the Halifax Giving Extra Awards; – 881 people trained through Money for Life, bringing the total to 2,035 since 2009; – 120 young people joined our Lloyds Scholars programme; – 297 social entrepreneurs supported through our Social Entrepreneurs programme; and – The equivalent of 18 full time colleagues working as Business Connectors helping local businesses, bringing the total to 42 since 2012"	Social_Relationship
"Children in NeedOur new Charity of the Year partnership for 2015 and 2016 is with BBC Children in Need, who share the same goal as the Group in supporting communities across the UK. Our 2015 colleague fundraising target is £2 million.COLLEAGUESOur colleagues are at the heart of our business and are critical in ensuring we become the best bank for customers."	Social_Relationship
"Diversity and inclusionWe want our Group to be a genuinely inclusive place to work, with every colleague treated fairly, with dignity and respect. We’ve made public commitments and set bold targets on diversity and inclusion in our Helping Britain Prosper Plan. These include commitments to: increase the proportion of senior management roles held by women; retain our Gold Standard as a disability-confident organisation; and increase the engagement scores of ethnic minority colleagues, disabled colleagues and lesbian, gay, bisexual and transgender colleagues, measured via our Colleague Survey. We plan to make more diversity and inclusion pledges"	Human
"in the future, as we work to build a culture in which all colleagues can be themselves at work and progress solely on the basis of merit. We always aim to appoint the best person available into any role, but also to attract talented people from diverse backgrounds and to be unbiased in the way we assess, select, appoint and promote them. We encourage job applications from those with a disability and run a work experience programme with Remploy to support people with disabilities wanting to enter the workplace. We offer a range of programmes to support disabled colleagues including the workplace adjustment programme, which provides physical and non-physical adjustments to support colleagues in their roles. Since 2002, 1,300 colleagues have participated  in and benefited from our positive action career development and training programmes for disabled colleagues."	Human
"Gender:Percentage of colleagues who are female2 58.6% 58.7%Female managers2 45.4% 45.1%Female senior managers2 29.3% 28.5%Disability:Percentage of colleagues who disclose they have a disability  1.3% 1.4%Ethnic background:Percentage of colleagues from an ethnic minority  6.8% 6.4%Ethnic minority managers  6.2% 5.8%Ethnic minority senior managers  3.5% 2.9%Sexual orientation:Percentage of colleagues who disclose they are lesbian, gay, bisexual or transgender"	Human
"Learning and developmentWe can only become the best bank for customers if all colleagues are capable of carrying out their roles to the best of their ability. Throughout 2014, we promoted the learning and development opportunities currently available to colleagues by running a series of coordinated campaigns, including road shows at Group locations across the UK, National Learning at Work Week and National Customer Service Week. Increasing digitisation is reflected through our colleagues having access to training in a range of media – how, when and where they need it."	Human
"For us, ‘best bank’ means doing business honestly and ethically, in ways that benefit our customers, colleagues, communities, other stakeholders and  the environment"	Social_Relationship
	
"STAKEHOLDERSWe have an active stakeholder engagement plan to ensure, through two-way dialogue, we listen to, and understand our stakeholders’ requirements.Investors and rating agenciesWe undertook more than 1,000 meetings with investors in 2014. We regularly engage SRI/ESG investors as well as investment analysts to provide them with information on our performance, strategic plans and how we do business responsibly. In 2014 we held our first responsible business webinar with investors and analysts"	Unclassified
"We want to work together with our suppliers and others in our supply chain to ensure we source goods and services in ways that are responsible, sustainable, mutually beneficial and provide best value for our customers and shareholders."	Social_Relationship
"n 2014 we achieved a number of key milestones in our Sourcing Plan, including the launch of our Code of Supplier Responsibility which sets out the minimum standards we expect from all suppliers. These standards are based on the social, ethical and environmental principles that we believe a responsible business should demonstrate. We also introduced our Group-wide Supplier Qualification system, which will help us standardise and manage requests for compliance and assurance data."	Social_Relationship
"GovernmentWe’re working directly with the UK government, members of Parliament and other stakeholders to improve ethical and quality standards in the banking industry. To help rebuild trust in banking, we must do, and be seen to be doing, the right thing – helping Britain prosper through our business activities in line with our strategy to become the best bank for customers"	Social_Relationship
"ENVIRONMENTOur ability to help Britain prosper is inextricably linked to wider environmental issues. Man made climate change and global trends such as resource scarcity, extreme weather and rising energy and commodity prices have an impact on our stakeholders and our own operations."	Natural
"We recognise the global challenge posed by these wider issues, and our responsibility to reduce the environmental impacts of our business operations. We are committed to managing our direct environmental impacts in a responsible manner and reducing our greenhouse gas emissions. We do this through our Environmental Action Plan, through which we aim to maximise the opportunity to create business value and minimise business risk in relation to our direct environmental impact."	Natural
"Our approach towards managing our environmental impact is set out  in our Environmental Statement, available online.Greenhouse gas emissionsWe have voluntarily reported on our greenhouse gas emissions and environmental performance in our annual Responsible Business Report and Annual Report and Accounts since 2009, but since 2013 we have reported emissions in line with the requirements of the Companies Act 2006. Measuring emissions over time has enabled us to make appropriate investment in targeted reduction activities"	Natural
"– CO2e emissions (tonnes)We report our emissions in terms of CO2 equivalent tonnes (CO2e). This year our overall carbon emissions have decreased by 2.2 per cent year-on-year and by 20.9 per cent against our 2009 baseline. The majority of this reduction is attributable to the reduction in consumption of gas and electricity, which constitute the largest proportion of our emissions. This reduction is mainly due to energy management activity, for example continued optimisation of building management systems to ensure that heating and ventilation plant and lighting run times are matched to actual building occupancy times, and investment in 2014 of around £3.8 million in specific energy efficiency measures, such as boiler controls, new lighting and building management upgrades"	Natural
"The only area where we’ve seen an increase in CO2e related to consumption, relates to oil. The main reason is due to the new Horizon data centre becoming operational in the past year and receiving several deliveries of new oil."	Natural
"CO2e emissions (tonnes)   Oct 13‑Sep 14 Oct 12-Sep 13Total CO2e emissions 440,835 450,723Scope 1 emissions 54,169 65,186Scope 2 emissions 263,129 259,253Scope 3 emissions 123,537 126,284Restated 2012/2013 emissions data to reflect improved reporting processes, using actual data to replace estimations"	Natural
"All data has been calculated to remove the impact of divestment activity in 2014, both from the current reporting year emissions and prior years.Emissions in tonnes CO2e in line with a recognised carbon accounting standard. A definition of Scope 1,2,3 emissions is provided in the Lloyds Banking Group criteria statement available online at www.lloydsbankinggroup.comScope 1 emissions include combustion of fuel and operation of facilities.Scope 2 emissions have increased despite a reduction in electricity consumption due to a significant increase of global-warming potential of the UK grid mix"	Natural
"MethodologyWe follow the principles of the Greenhouse Gas (GHG) Protocol Corporate Standard to calculate our Scope 1, 2 and 3 emissions from  our worldwide operations.The reporting period for emissions is October 2013 to September 2014, which is different to that of our Director’s Report (January 2014 – December 2014). This is in line with Regulations in that the majority of the emissions reporting year falls within the period of the Directors’ Report."	Natural
"We report emissions based on an operational boundary. The scope of our reporting is in line with GHG Protocol and covers Scope 1, Scope 2 and Scope 3 emissions. Reported Scope 1 emissions cover emissions generated from gas and oil used in Group buildings, emissions from UK company-owned vehicles used for business travel and emissions from the use of air conditioning and chiller/refrigerant plant. Reported Scope 2 emissions cover emissions generated from the use of electricity. Reported Scope 3 emissions relate to business travel undertaken by colleagues and emissions associated with the extraction and distribution of each of our energy sources – electricity, gas and oil. A detailed definition of these emissions can be found in our environmental criteria statement online"	Natural
ntensity ratio An intensity ratio of GHG gases per £m of underlying income has been selected. Oct 13‑Sep 14 Oct 12-Sep 13GHG emissions per unit income 24.0 24.9	Natural
"OmissionsEmissions associated with joint ventures and investments are not included in the emissions disclosure as they fall outside the scope of our operational boundary. We do not have any emissions associated with heat, steam or cooling. We are not aware of any other material sources of omissions from our emissions reporting."	Natural
	
"Effective risk management,  governance and controlManaging risk effectively is important for any bank and is fundamental to our strategy. We are now a low cost, low risk, UK focused retail and commercial bank. This has been achieved by maintaining a conservative business model which embodies a risk culture founded on a prudent appetite for risk.Our approach to risk is founded on an effective control framework and a strong risk management culture which guides how our employees approach their work, the way they behave and the decisions they make. The amount and type of risk that we are prepared to seek, accept or tolerate, otherwise known as risk appetite, works in tandem with our strategy and is approved by the Board. Our risk appetite is then embedded within policies, authorities and limits across the Group."	Unclassified
"RISK AS A STRATEGIC DIFFERENTIATORThe Group strategy and risk appetite were developed together to ensure one informed the other in creating a strategy that delivers on becoming the best bank for our customers whilst helping Britain prosper and creating sustainable growth over time.Risks are identified, managed and mitigated using our Risk Management Framework (see page 31). The principal risks we face, which could significantly impact the delivery of our strategy, are discussed on pages 32 and 33"	Unclassified
"Sustainable growthThe role of risk is to provide proactive support and constructive challenge  to the business to deliver sustainable growth, which is achieved through informed risk decision making and superior risk and capital management, supported by a consistent risk-focused culture across the Group."	Unclassified
"Conservative approach to riskWe have a fully embedded conservative approach to, and prudent appetite for, risk with risk culture and appetite driven from the top.– Strong control frameworkThis framework is the foundation for the delivery of effective risk management and ensures that the business units operate within approved parameters"	Unclassified
"ffective risk analysis, management and reportingThis identifies opportunities as well as risks and ensures risks are managed appropriately and consistent with strategy. Our principal risks and performance against risk appetite are monitored and reported regularly to senior management using quantitative  and qualitative analysis and are subject to relevant stress testing.  This enables us to understand the risk in the business at both  an individual risk type and aggregate portfolio level."	Unclassified
Managing risk effectively is a key focus and is one of the five criteria within the Group Balanced Scorecard on which business areas and individual performance are judged. Our approach to risk means that businesses remain accountable for risk but a strong and independent risk function also helps ensure adherence to the Group’s risk and control frameworks. Continued investment in risk systems and processes help differentiate our risk management approach.	Unclassified
"Capital strengthDuring the year, our common equity tier 1 (CET1) capital position has continued to build to 12.8 per cent, increasing by 2.5 per cent in the  year, in line with our capital generative strategy. The Group’s EBA and PRA stress testing exercises exceeded the relevant thresholds and the PRA confirmed no requirement to submit a revised capital plan or undertake additional management actions."	Financial
"ImpairmentThrough effective risk management our impairment charge improved by 60 per cent to £1,200 million, mainly driven by the reduction in Run-off assets and the sustained improvement in asset quality across the Group"	Unclassified
"Operational agility Risk Division has continued to invest via the Risk Transformation Programme, driving improvements in supporting systems, simplified processes, improved customer experience and improved credit  decision engines in order to deliver the most efficient and effective returns for the Group, underpinning the Group’s targeted objective  of sustainable growth"	Intellectual
"State aid commitmentsRisk Division continued to support the Group’s divestment of TSB, with the Group selling 35 per cent of ordinary shares by way of an Initial Public Offering in June 2014, 3.5 per cent through utilisation of an over allotment option in July 2014 and a further 11.5 per cent of the ordinary shares by way of an Institutional Placing in September 2014, remaining  on course to complete the divestment by the end of 2015."	Unclassified
"Enabling and delivering sustainable growth Helping the business make the right decisions through proactive support and constructive challenge to the business areas whilst delivering the right risk and customer outcomes.–  Creating the best customer experiencePutting our customers at the heart of our decisions throughout the Group through continued embedding of the conduct strategy and cultural change.–  Becoming simpler and more efficient  Responding quickly to changing customer, business and regulatory needs."	Social_Relationship
	
RISK GOVERNANCERisk management strategy and risk appetite are developed and reviewed in tandem with Group strategy. The Group uses an enterprise-wide risk management framework to ensure a robust and consistent approach to risk management is applied across all business areas and all risk types in order to drive improvements in its risk profile in line with risk appetite.	Unclassified
"The framework articulates individual and collective accountabilities for risk management, risk oversight and risk assurance and supports the discharge of responsibilities to customers, shareholders and regulators. It establishes a common risk language which assigns risks to which the Group is exposed, to categories which are used consistently to support risk aggregation and reporting. The frameworks will evolve and be periodically updated to reflect any changes in the nature of our business and the external environment.The framework outlines the key risk management activities undertaken consistently across the Group for all types of risk."	Unclassified
"Governance is maintained through delegation of authority from the Board, down through the management hierarchy to individuals, and is supported by a committee based structure designed to ensure that our risk appetite, policies, procedures, controls and reporting are fully in line with regulations, law, corporate governance and industry best practice"	Unclassified
"Our approach to risk is founded on a robust control framework and a strong risk management culture which ensures that business units remain accountable for risk and therefore guides the way all employees approach their work, behave and make decisions. Board-level engagement, coupled with the direct involvement of senior management in Group-wide risk issues at Group Executive Committee level, ensures that issues are promptly escalated and remediation plans are initiated where required"	Unclassified
The interaction of the executive and non-executive governance structures relies upon a culture of transparency and openness that is encouraged by both the Board and senior management. A strong control framework remains a priority for the Group and is the foundation for the delivery of effective risk management. Performance is optimised by allowing business units to operate within approved parameters	Unclassified
Processes and infrastructure are being invested in to further improve our risk  management capabilities	Intellectual
Carried out by all three lines of defence and is an integral part of our control effectiveness assessmen	Intellectual
"Defined processes exist to identify, measure and control our current and emerging risks"	Intellectual
"Maintains a robust control framework, identifying and escalating emerging risks and supporting sustainable growth"	Intellectual
"Monitoring, oversight and assurance ensures effective risk management across the Group"	Unclassified
Supporting a consistent approach to the Group-wide behaviour and risk decision making. Consistency is delivered through the policy framework and risk committee structure	Unclassified
The Risk Appetite Framework ensures our risks are being managed in line with our risk appetit	Unclassified
Determined by the Board and Senior Management. Business units formulate their strategy in line with the Group’s risk appetite	Unclassified
Through Board-delegated Executive Authorities there is effective oversight of risk management consistent with  risk appetite	Unclassified
Setting risk appetite and strategy Approval of the risk management framework and Group-wide risk principles	Unclassified
	
"Credit riskAny adverse changes in the economic and market environment we operate in, or the credit quality and/or behaviour of our borrowers and counterparties would reduce the value of our assets and potentially increase our write-downs and allowances for impairment losses, adversely impacting profitability."	Unclassified
"Credit policy incorporating prudent lending criteria aligned with  the Board approved risk appetite to effectively manage credit risk.–  Clearly defined levels of authority ensure we lend appropriately and responsibly with separation of origination and sanctioning activities. –  Robust credit processes and controls including well-established governance to ensure distressed and impaired loans are identified, considered and controlled with independent credit risk assurance."	Unclassified
"Conduct riskWe face significant potential conduct risk, including selling products to customers which do not meet their needs; failing to deal with customers’ complaints effectively; not meeting customers’ expectations; and exhibiting behaviours which do not meet  market or regulatory standards"	Social_Relationship
Customer focused conduct strategy implemented to ensure customers are at the heart of everything we do.	Social_Relationship
"Product approval, review processes and outcome testing supported  by conduct management information.–  Clear customer accountabilities for colleagues, with rewards driven off customer-centric metrics.–  Learning from past mistakes, including root cause analysis"	Intellectual
"Market riskKey market risks include interest rate risk across the Banking and Insurance businesses. However, our most significant market risk is from the Defined Benefit Pension Schemes (DBPS) where asset and liability movements impact on our capital positio"	Unclassified
"A structural hedge programme has been implemented to manage liability margins and margin compression.–  Board approved pensions risk appetite covering interest rate,  credit spreads and equity risks. Credit assets are being purchased and equity holdings reduced in the pension schemes.–  Stress and scenario testing of risk exposures."	Unclassified
"Operational riskWe face significant operational risks which may result in financial loss, disruption or damage to the reputation of the Group. These include the availability, resilience and security of our core IT systems and the potential for failings in our customer processes"	Intellectual
"Continually review IT system architecture to ensure that our systems are resilient and that the confidentiality, integrity and availability of our critical systems and information assets are protected against cyber attacks.–  Continue to implement the actions from the 2013 independent IT Resilience Review to enhance the resilience of systems  supporting the processes most critical to our customers"	Intellectual
"Funding and liquidity riskOur funding and liquidity position is supported by a significant and  stable customer deposit base. A deterioration in either our or the UK’s credit rating, or a sudden and significant withdrawal of customer deposits would adversely impact our funding and liquidity position"	Financial
At 31 December 2014 the Group had £109.3 billion of unencumbered primary liquid assets and the Group maintains a further large pool of secondary assets that can be used to access Central Bank liquidity facilitie	Unclassified
Daily monitoring against a number of market and Group specific early warning indicators and regular stress tests.–  Contingency funding plan to identify liquidity concerns earlier	Unclassified
"Capital riskOur future capital position is potentially at risk from a worsening macroeconomic environment. This could lead to adverse financial performance for the Group, which could deplete capital resources  and/or increase capital requirements due to a deterioration in customers’ creditworthiness"	Financial
