Text	Theme
"We are meeting our customers’ needs by creating a simpler, more responsive organisation and are investing in our digital capability while maintaining a comprehensive branch network."	Intellectual
By becoming the best bank for customers we believe we can help Britain prosper and deliver strong and sustainable returns for our shareholders	Natural
	
For more on our Retail division’s financial  performance go to page 44 or visit  www.lloydsbankinggroup.com 44 For more on our Commercial Banking division’s  financial performance go to page 46 or visit  www.lloydsbankinggroup.com	Unclassified
"COMMERCIAL BANKINGOur Retail division is a leading provider of current accounts, savings, loans and mortgages to personal and small business customers in the UK.We have an extensive multi-brand, multi-channel offering. With more  than 2,200 branches we have the largest branch network and one of the largest fee free ATM networks in the UK and also provide a comprehensive digital, telephony and mobile service. We serve millions of customers through our Lloyds Bank, Halifax, Bank of Scotland and Scottish Widows brands. Our Commercial Banking division has a rich heritage of supporting UK businesses from SMEs to large corporates and financial institutions.Commercial Banking provides lending, deposits and transaction banking services to corporate clients as well as offering expertise in capital markets (private placements, bonds and syndicated loans), financial markets (foreign exchange, interest rate management, money markets and credit) and private equity.     £3,228m £2,206m"	Unclassified
UNDERLYING PROFIT	Financial
1 in 4 £286bnRetail deposit balancesFirst-time buyers helped by  us to buy their first home	Unclassified
	
"Our Consumer Finance division provides asset finance solutions and credit cards to consumer and commercial customers.In Asset Finance, Black Horse provides motor finance loans to over 200,000 customers through more than 5,000 dealers. Lex Autolease  is the UK’s leading fleet management and fleet funding specialist  with close to 300,000 vehicles under management.We are also one of the UK’s leading credit card issuers through our Consumer and Commercial Cards businesses meeting the needs of seven million customers daily through purchasing and flexible short-term borrowing propositions and payment acceptance services for UK merchants."	Unclassified
"Our Insurance division provides customers with  long-term savings, investment and protection products  and general insurance.Our long-term savings, investment and protection products are offered under the Scottish Widows brand. Products are available through intermediaries, direct channels and also through our Retail division  via Lloyds Bank, Halifax and Bank of Scotland. The General Insurance business is a leading provider of home insurance in the UK, with products sold through the branch network, direct channels and strategic corporate partner"	Unclassified
l	Unclassified
	
"FINANCIAL PERFORMANCE  SUBSTANTIAL INCREASE  IN PROFITABILIT Y  AND RETURNS £7.8bn£1.8bn +26%Underlying profit increased  26 per cent to £7,756 million"	Financial
"Statutory profit before tax  of £1,762 million, despite legacy items including £2,200 million of PPI charges"	Financial
0.75pDelivery of strategy and increased profitability has enabled resumption of dividend	Unclassified
	
Completed sales totalling approximately 50 per cent of TSB	Financial
£17bnRun-off portfolio reduced by more than £140 billion to £17 billion	Unclassified
	
"Overview and strategyMy first year as Chairman of Lloyds Banking Group  saw the achievement of our 2011 strategic plan. We have delivered on our key strategic priorities over the last three years, reshaping the Group to focus on serving our UK customers and returning the balance sheet to strength"	Unclassified
while at the same time generating a significant improvement in underlying profitability and recommencing a dividend payment	Financial
"I would like to extend my thanks to the Board, the management team and all colleagues across the Group for their determination to see this through."	Unclassified
"While we are all proud of these achievements, we recognise that this is a base for the future, not the end of the strategic journey. There are major changes in the environment as well as our own capabilities that we need to address in the next phase of our development to become the best bank for customers and shareholders."	Unclassified
"The next phase of our strategy, announced in October, outlined how we will focus on creating the best customer experience, becoming simpler and more efficient and delivering sustainable growth."	Social_Relationship
"As a Board, we have spent much time discussing how we could take the business forward, recognising the impact that the evolving regulatory and competitive environment and customers’ changing needs are having on our UK retail and commercial banking focused business. We believe that digital transformation in particular will res"	Unclassified
We believe that digital transformation in particular will result in more fundamental change occurring in the banking industry over the next decade than we have seen in the last 200 years	Intellectual
"I am confident that our low cost, low risk, customer focused, UK retail and commercial banking strategy is the right one in the current environment. It capitalises on the Group’s unique assets, including its franchise and capabilities, and is also consistent with our prudent risk appetite as well as our mission to ‘Help Britain Prosper’"	Unclassified
"Alongside this strategic challenge, it is essential that we also rebuild trust. This is a major challenge for the UK financial services sector, not just because of the damage caused by the financial crisis but also because of the continuing legacy of past industry misconduct. As well as the continuing impact of issues such as Payment Protection Insurance we also announced settlements on LIBOR and BBA repo rate issues"	Unclassified
"The Board regards the actions of those individuals responsible for this misconduct as completely unacceptable. Their behaviour involved a gross breach of trust and we condemn it without reservation. Doing the right thing for customers is an integral part of our strategy and I am convinced that these actions are entirely unrepresentative of the vast majority of our staff who are committed to delivering outstanding service, recognising that trust is at  the core of our business."	Social_Relationship
"It is clear that regaining this trust, which is a business imperative rather than a ‘nice to have’, will take time. We are completely committed to achieving this by setting the highest possible standards of integrity to serve our customers and clients."	Social_Relationship
	
"RegulationAs a result of the financial crisis, there has been a  great deal of change in the regulatory environment in recent years. The regulators have made good progress in improving financial stability through prudential regulation and they are now putting greater emphasis on protecting"	Unclassified
"Capital requirements, though not yet finalised, are much clearer and the significant progress made in improving our capital position means we are now well placed. During the year, the Group met the capital benchmarks set out by the European Banking Authority (EBA) and the Prudential Regulation Authority (PRA) stress testing exercises, with no additional capital action required; a further demonstration  of our robust capital, liquidity and funding position."	Financial
"The ring-fence perimeter was clearly set in 2014, although final details and implementation of the rules remain undetermined. Our strategy continues to envisage a simple, low risk organisation with a business model focused on traditional retail and commercial banking, that would predominantly sit within the ring-fence"	Unclassified
"We were delighted to welcome four new Independent Non-Executive Directors to the Board during the year. Dyfrig John joined in January, Nick Prettejohn and Simon Henry in June and Alan Dickinson in September. These appointments bring a good balance of additional skills and experience to our Board"	Human
"Our Deputy Chairman, David Roberts, stepped down in May to become Non-Executive Director and Chairman-Elect at Nationwide. I and my colleagues are grateful for the tremendous contribution he made to the Group during his period on the Board. We were pleased to announce the appointment of Anita Frew, a non-Executive Director with the Group since 2010, to this role."	Unclassified
Regaining trust is a business imperative rather than a ‘nice  to have’. We are completely committed to achieving thi	Social_Relationship
"Our BoardThe Board has seen a number of changes this year, and in line with the provisions of the UK Corporate Governance Code and the interests of good corporate governance, all Directors are required to submit themselves for re-election on an annual basi"	Unclassified
"We are committed to ensuring we have the right balance of skills and experience within the Board, and we annually review its composition, and the diversity of backgrounds of its members."	Human
"Board oversight – key topicsDuring 2014, the Board continued to review the Group’s corporate strategy, the operation of the business and our results within a framework of prudent and effective controls, including the assessment and management of risks. Key topics arising through the year included"	Unclassified
"discussion and oversight of the Group Strategic Update;–  the appointment of four Non-Executive Directors in order to strengthen the Board’s experience in the areas of financial services, banking, risk and insurance;–  the initial public offering (IPO) of TSB Banking Group plc  in order to meet the Group’s commitments to the European Commission;–  the banking stress tests conducted by the EBA and the PRA in order to assess banks’ resilience to market downturns;"	Unclassified
the resolution of legacy issues with regulators in  the UK and US in respect of the manipulation of the  London Interbank Offered Rate (LIBOR) and the  Sterling Repo Rate and continued focus on  Payment Protection Insurance; and	Unclassified
–  the continued creation of a corporate culture that values integrity and best practice standards and that puts customers first.	Social_Relationship
	
"This is vitally important. As I noted earlier, trust is not a ‘nice to have’ – it’s a ‘must have’. It provides the foundations on which we can build sustainable success as a responsible business dedicated to meeting our customers’ needs. It is also, I am convinced, a true reflection of the values and commitment of our hardworking staff, all of whom I would like to thank on behalf of the Board for their dedication to serving our customers"	Social_Relationship
"RemunerationWe continue to believe that remuneration policy at all levels, including for senior executives, needs to motivate staff to deliver strong, sustainable growth whilst supporting the business strategy. We strongly believe in ‘rewards for success’, properly earned not just paid by default. That means aligning rewards to the longer term, sustainable success of our business and through this the delivery of value to shareholders. It also means holding back or removing performance rewards where managers have  failed to meet their objectives"	Unclassified
"Despite better results in 2014, the total bonus outcomee for the year has decreased by approximately 3.6 per cent (after adjusting for TSB). This reflects the continuing overhang of past conduct issues. Discretionary bonus awards remain"	Unclassified
"a very small percentage of revenues at approximately 2 per cent, and represent approximately 4.5 per cent of pre-bonus underlying profit before tax, compared to 6 per cent in 2013. Cash bonuses are capped at £2,000 with additional amounts paid in shares and subject to deferral and performance adjustment. Average bonus awards across all our staff are approximately £4,500."	Financial
More information on how we ensure our approach to remuneration supports the business strategy can be found  in the Directors’ remuneration report later in this documen	Unclassified
"OutlookAs we enter 2015, a ‘milestone’ year during which we celebrate the 200th anniversary of Scottish Widows and the 250th anniversary of Lloyds Bank, it is important that we look back with pride but also keep looking forward and adapt to the changing landscape of the future. I believe we are very well placed to make the most of the opportunities that exist."	Unclassified
"Community and cultureWith a network of more than 2,200 UK branches and a focus on supporting small to medium-sized businesses, we are well positioned to help our local and national communities. Our commitment to invest in the long-term economic future of the UK is highlighted, not just through the significant lending to customers, particularly SMEs and first-time buyers, but also through the many community programmes we run, including our Lloyds Scholars programme, our Social Entrepreneurs programme and our Career Academies."	Social_Relationship
"We remain dedicated to our charitable initiatives and I am thrilled that we raised more than £6 million from our two-year partnership with the Alzheimer’s Society and Alzheimer Scotland. The money, which is significantly higher than our 2014 target, will go towards the Dementia Research Leaders Programme, working to improve dementia research and transform our understanding of the condition"	Social_Relationship
"With a network of more than 2,200 UK branches and a focus on supporting small to medium-sized businesses, we  are well positioned to help our local and national communities"	Social_Relationship
I am also delighted to announce that BBC Children in Need will be the Group’s Charity of the Year partnership for 2015 and 2016. We chose BBC Children in Need because we share the same goal of supporting communities across the UK and we will be working together to change the lives of disadvantaged children and young people	Social_Relationship
"A responsible businessDoing business fairly and responsibly is the best way to rebuild trust with Britain’s households, businesses and communities. It also rebuilds our colleagues’ pride in our Group. Our business model puts customers at the heart; based on traditional attributes such as prudence and a long-term view, whilst making the most of emerging digital channels. The best of the past combined with the best of  the present and the future"	Social_Relationship
"I see increasing evidence that we are returning to the qualities that historically made our bank a pillar of local communities, applying these qualities to meet the changing demands of our customers"	Social_Relationship
	
"Highlights2014 was a year of continued delivery for the Group, with the achievement of the key objectives set out in our 2011 strategic plan resulting in a significant transformation of the business and improvement in performance. Strategically, we are now a low risk bank, with a strong balance sheet and funding position and industry cost leadership, all of which provide competitive differentiation"	Intellectual
"This delivery has, in turn, enabled the UK government to make further progress in returning the Group to full private ownership. In 2014 the UK government reduced its shareholding through the second successful sale of part of its stake in March and the launch of a pre-arranged trading plan in December which provides a means for an orderly sell down that will end no later than June 2015. On 20 February 2015, we were advised that UKFI’s interest in the Group had reduced to 23.9 per cent. In the summer, we sold 38.5 per cent of TSB via a well-received Initial Public Offering, with this and the subsequent sale of a further 11.5 per cent stake in September resulting in us being firmly on track to meet our European Commission State Aid commitments."	Unclassified
i	Intellectual
"The Board recognises the importance of sustainable and growing dividends to our shareholders and is today announcing the resumption of dividend payments, with a recommended dividend payment of 0.75 pence per share in respect of 2014. This is a symbolic development that bears testament to our successful transformation and improved risk profile of the business."	Unclassified
"Given this strong strategic progress and the improvement in our financial performance and position, we have a firm foundation to deliver the new strategic priorities that we set out in October and we are well placed to continue to support and benefit from the strengthening UK economy and to be the best bank for our customers and shareholders"	Unclassified
m	Unclassified
"Financial performance in 2014We delivered a significant improvement in financial performance at both an underlying and statutory level. Underlying profit increased by 26 per cent to £7,756 million, with the Group’s return on risk-weighted assets (RoRWA) improving by 88 basis points to 3.02 per cent. At a divisional level, all of our banking businesses delivered a robust performance with improvements in underlying profit and RoRWA in our Retail, Commercial Banking and Consumer Finance divisions after increased investment made to deliver growth. Underlying profit was lower in our Insurance division, reflecting the challenging market backdrop and regulatory and legislative changes that have similarly affected the wider industry"	Financial
"Net interest income increased by 8 per cent, driven by a 33 basis point improvement in the net interest margin to 2.45 per cent and increased lending in our key customer segments. Other income excluding St. James’s Place effects was 9 per cent lower, reflecting business disposals and a challenging operating environment. Underlying costs were reduced by 2 per cent, while the effective management of our lending portfolio, coupled with the benign economic and low interest rate environment, resulted in a substantial 60 per cent reduction in the impairment charge to £1,200 million."	Financial
"On a statutory basis, the Group reported a profit before tax of £1,762 million compared to £415 million in 2013. This was after £2,200 million of charges in respect of PPI (2013: £3,050 million) and other regulatory provisions of £925 million (2013: £405 million)"	Financial
"We enter the next phase of our strategic journey from a position of strength, having delivered against our key strategic priorities"	Unclassified
	
"Helping Britain prosper and delivering growth  in our key customer segments As a UK centric retail and commercial bank, our future is inextricably linked to the health of the UK economy. In 2014 the UK economy continued to recover, with GDP growing robustly, unemployment falling, and both consumer and business confidence increasing. UK house prices have also continued to recover strongly, with an 8.4 per cent increase in the year. Against this, affordability measures remain good, with the recent calming of house price appreciation in London and the South East a welcome development."	Unclassified
"We are committed to helping Britain and its communities and in March we launched our Helping Britain Prosper Plan. This initiative comprises a number of public commitments in areas where we can make the biggest difference and create value for our customers across households, businesses and our communities, in turn supporting our goal of being the best bank for customers."	Social_Relationship
"Since its launch, all of our divisions have made good progress in implementing this Plan, with the Group exceeding each of its lending commitments in 2014 while also delivering lending growth in our key customer segments."	Unclassified
"n our Retail division, we provided £11.9 billion of lending to over 89,000 first-time buyers as well as 1 in 5 of all mortgage loans to customers buying their home in the UK in 2014, with total gross mortgage lending of £40 billion, 13 per cent higher than the prior year. We remain the largest participant in the UK government’s Help to Buy mortgage guarantee scheme, lending £1.9 billion through this scheme in the year. In Retail Business Banking, we also supported over 100,000 new business start-ups."	Unclassified
"The Commercial Banking division continued to take a leading role in supporting the UK economic recovery, with SME lending growing for the fourth consecutive year against a market that has contracted each year, increasing by 5 per cent in 2014. Lending to Mid Market corporates also increased by 2 per cent in a market that contracted by around 3 per cent. We remain firm supporters of the UK government’s Funding for Lending scheme, committing over £15.5 billion of eligible lending and £1 billion to UK manufacturing during 2014"	Unclassified
"In Consumer Finance, we achieved UK lending growth of 17 per cent to £16.0 billion, driven by 43 per cent growth in Asset Finance and a return to growth in our cards business following eight years of decline. New business growth was also strong, with a 48 per cent increase in Black Horse new business partly reflecting the launch of the Jaguar Land Rover partnership, and Cards benefiting from a 15 per cent increase in balance transfer volumes from new and existing customers as well as a 4 per cent increase in new consumer credit card accounts opened."	Unclassified
"n Insurance, we have seen good momentum in our corporate pensions business where we are a market leader, serving over 11,500 employers and 1.4 million employees who have invested a total of £27 billion of assets with us. In 2014, the number of employees covered by these schemes increased by 40 per cent, principally reflecting our ongoing support for employers through the auto-enrolment process"	Unclassified
"Our support for our customers and communities does not just extend to the lending commitments we have made to our key customer groups. It also covers a number of other initiatives through the Helping Britain Prosper Plan. In 2014, we delivered against the majority of these major commitments, donating £16.5 million to the Bank’s Foundations to help tackle disadvantage and now having trained over 1,300 colleagues as mentors to SMEs and social entrepreneurs and provided over 940,000 of paid volunteer hours to support community projects"	Social_Relationship
Our strong performance in  2014 marks the culmination of three years of strategic delivery that has transformed the business for the benefit of our customers and shareholders.	Unclassified
	
"Delivering the best bank to our key stakeholdersOur strong performance in 2014 marks the culmination of three years of delivery against our strategic plan that has transformed the business for the benefit of our stakeholders.For our shareholders, we have delivered a significant improvement in financial performance, while improving the risk profile of the bank and strengthening the balance sheet"	Financial
"We have strengthened underlying performance from a loss of £0.9 billion in 2010 to a profit of £7.8 billion in 2014, driven by a combination of lower impairment charges and a reduction in the Group’s cost base"	Financial
"While our statutory result has also increased significantly over this period, our pre-tax profit of £1.8 billion in 2014 continued to be affected by PPI and other regulatory provisions as well as costs associated with TSB, the Simplification programme and the ECN exchange. Looking ahead, while regulatory and conduct risks remain, we believe that the Group’s statutory performance will become significantly less impacted by such issues, resulting in a far greater proportion of our underlying financial performance flowing through to shareholder returns over time."	Financial
"In 2014 we achieved our enhanced target of delivering £2 billion of annual run-rate savings through the first phase of our Simplification programme, resulting in a reduction in our cost base from over £11 billion in 2010 to £9.0 billion (excluding TSB). Our cost:income ratio of 51.2 per cent"	Intellectual
"is now the lowest amongst our major UK banking peers, in turn delivering a cost leadership position as a strategic differentiator and source of competitive advantage."	Intellectual
"Being a low risk bank is also central to our strategy and business model, while supporting our aim of being best bank for our shareholders by reducing earnings volatility. This is illustrated by our credit default swap (CDS) spread reducing from over 300 basis points (bps) at the end of 2011 to less than 50 bps at the end of 2014, which is one of the best in the banking sector worldwide"	Unclassified
"We have significantly reduced risk in our lending business through careful portfolio management, the centralisation of the risk division and the implementation of tighter underwriting standards and controls. As a consequence, non-performing loans have reduced from over 10 per cent of lending balances in 2010 to less than 3 per cent in 2014. Over the same period, we have successfully reshaped the Group, reducing our non-core portfolio from £194 billion, or 25 per cent of customer loans, by £148 billion in a capital accretive way. As of December 2014, we now have a remaining Run-off portfolio of £16.9 billion, with lending assets of £14.4 billion within this total representing 3 per cent of customer loans"	Unclassified
"RESHAPEour business portfolio  to fit our assets, capabilities  and risk appetite  –  Non-core assets reduced by more than £140 billion to £17 billion–  International presence reduced from more than 30 countries to six–  Asset quality ratio of 24 basis points, significantly ahead of original guidance of 50-60 basis points"	Manufactured
