Text	Theme
STRENGTHENthe Group’s balance sheet  and liquidity position  –  Capital position improved with a fully loaded common  equity tier 1 ratio of 12.8 per cent–  Reliance on wholesale funding reduced by more than £180 billion–  Loan to deposit ratio improved from 154 per cent to 107 per cent	Financial
"SIMPLIFYthe Group to improve  agility and efficiency  –  Simplification programme delivered £2 billion per annum of cost savings, £300 million ahead of original target– Cost leadership position created"	Intellectual
	
"a combination of earnings generation, a reduction in risk-weighted assets as we de-risk the business, and other management actions. Our CET1 ratio is now amongst the strongest within the banking sector worldwide, positioning us well against the backdrop of evolving regulatory requirements for capital and leverage."	Unclassified
"Most recently this has been demonstrated by the Group exceeding the minimum thresholds set in the recent stress tests conducted by the EBA and the PRA, despite the heavy weighting of the stress parameters against a UK retail and commercial banking business model such as ours."	Unclassified
"At the same time, we have significantly reduced our reliance on wholesale funding through the careful management of our lending portfolio and the growth in our relationship deposit base, with our loan to deposit ratio strengthening from 154 per cent in 2010 to 107 per cent. Our wholesale funding requirement at the end of 2014 of £116 billion compares to £298 billion at the end of 2010 and is broadly matched by our primary liquid asset portfolio of £109 billion."	Unclassified
"Being the best bank for customers is at the heart of our strategy. In support of this, we have continued to invest in our product propositions as well as our branches, digital and telephony channels, with key customer benefits from this investment ranging from reduced processing times, improved ease of access and convenience, and greater efficiency"	Social_Relationship
"Digital remains a key area of growth and investment for the business and has now been expanded as a Group-wide division spanning across all business areas, reflecting our customers’ evolving preferences in how they interact with us. At the end of 2014, our active online user base was over 10.4 million customers, within which our active mobile users were over 5 million: a 29 per cent increase compared to the end of 2013"	Intellectual
"Our success in improving the customer experience has been reflected in net promoter scores (NPS), which have increased by 50 per cent since 2010, and Group reportable banking complaints (excluding PPI), which have reduced significantly over the same period and are now approximately 50 per cent lower than the average of our major banking peers."	Social_Relationship
"Rebuilding customer trust remains a key imperative for the business. In support of this, we have continued to transform the corporate culture and have completely overhauled the performance and reward framework for our customer-facing colleagues, with performance now predominantly assessed on the basis of customer feedback."	Social_Relationship
We have also strengthened the control environment through changes to our organisational design and the introduction of standardised templates across the Group to assess and monitor our risk appetite	Intellectual
"While these improvements have been essential in helping us to rebuild customer trust, we recognise there is more to do and that we still have legacy issues to work through."	Social_Relationship
"The first of our three strategic priorities is ‘creating the best customer experience’. We will achieve this through our multi-brand, multi-channel approach by combining comprehensive online and mobile capabilities with face-to-face services delivered through our branch and relationship manager network"	Social_Relationship
"We will invest £1 billion over the next three years in digital capability across all business divisions, delivering better service with greater efficiency. This transformation will reflect our customers’ changing preferences in how they choose to interact with us, providing seamless access through a secure and resilient digital infrastructure."	Intellectual
"Secondly, we will create operational capability by ‘becoming simpler and more efficient’, enabling us to be more responsive to changing customer expectations and to maintain our cost leadership position amongst UK high street banks as a source of competitive advantage. Through the simplification and increased automation of key processes, the reduction in third party spend and changes to our organisational design, we expect to deliver a further £1 billion of annual run-rate savings by the end of 2017, creating value for customers and improving our long-term competitiveness."	Intellectual
"Our business has been transformed, with a reshaped, low risk portfolio, a strengthened capital and funding position  and a more efficient cost base."	Intellectual
	
"We intend to maintain market leadership in our main retail business lines of mortgages and current accounts by growing in line with the market, making the most of our multi-brand, multi-channel strategy to meet customer needs"	Intellectual
"We have also identified a number of growth opportunities in segments and areas where we are currently underrepresented and will look to grow above the market, including business banking, financial planning and retirement, and unsecured consumer lending. Consequently, over the next three years we expect to grow net lending in our key customer segments by over £30 billion, comprising growth in line with the market in retail mortgages, coupled with increases in net lending of £3 billion in both our SME and Mid Markets segments, £4 billion growth in customer assets in Asset Finance and £2 billion in credit cards."	Unclassified
We also expect to grow customer assets by over £10 billion in our Insurance division over this timeframe through supporting our retail and corporate customers in making long-term preparations for retirement	Unclassified
"OutlookThanks to the hard work and commitment of our colleagues, we are entering the next three year phase of our strategy from a position of strength. Together, we have delivered the strategic objectives we set out in 2011 resulting in a business that has been transformed, with a reshaped and low risk portfolio focused on our core UK markets, a strengthened capital and funding position, and a more efficient cost base."	Intellectual
"In the shorter term, we expect the Group to continue to perform strongly in 2015, with our net interest margin expected to strengthen to around 2.55 per cent, other income to remain broadly stable, and our low risk business model expected to be reflected in an asset quality ratio of around 30 basis points. We also expect our capital generation to remain solid, with our CET1 ratio expected to increase by between 150 and 200 basis points per annum"	Financial
"While we recognise we still have a lot more to do, these strong foundations give us confidence in our prospects and our ability to achieve our strategic objectives over the next three years, despite uncertainties with regard to the political, regulatory, economic and competitive environment. We are therefore well positioned to continue to progress towards being the best bank for our customers while delivering strong and sustainable returns for our shareholders and supporting the UK economic recovery."	Unclassified
"We will invest £1 billion  over the next three years  in our digital capability  across all divisions,  delivering better service  with greater efficiency."	Intellectual
	
"UK ECONOMIC TRENDSEconomic recovery has picked up in 2014Seven years after the start of the financial crisis, the UK economy is returning to a level of stability. Initial estimates indicate that economic growth rose to 2.6 per cent in 2014 from 1.7 per cent in 2013, the strongest rate of growth since 2006 and above the economy’s long-term average growth rate. Unemployment has fallen rapidly – by twice as much in 2014 as across the previous two years combined – and at 5.7 per cent has now reversed the bulk of its rise during the recession. Consumer spending growth and the level of private car registrations have returned to pre-crisis rates. Rising business confidence in response to the upturn in demand has been reflected in a significant increase in business investment, now higher as a share of GDP than before the crisis. The rate of corporate failure has fallen back after its rise in 2009, and is now the lowest on record (since 1984) at 0.5 per cent."	Unclassified
"At the root of the economic recovery is the progress that has been made on reducing the high levels of debt that were a key driver of pre-crisis growth. Household debt has fallen back to decade-ago levels relative to incomes, and with interest rates low the burden of debt payments is its lowest since the late 1990s. That has decreased the pace of consumer deleveraging, helping spending growth to recover. The government is broadly half way through its deficit reduction programme, and the pace of fiscal consolidation has also eased markedly, thus reducing its drag on growth. Most of the banking sector, including Lloyds, is on target to meet the new higher capital and liquidity levels mandated by CRD IV and the PRA, so lending supply is able to respond to rising demand."	Unclassified
"But as the deleveraging process is not yet complete, some aspects of the economy continue to look abnormal. Most obviously, the Bank of England’s Bank Rate (base rate) has remained at 0.5 per cent since 2009. The fiscal deficit remains large at over 5 per cent of GDP, and so requires a continued squeeze on public spending throughout the next Parliament after the May 2015 election. In addition, export growth remains subdued by weak"	Unclassified
"demand in the Eurozone, the result of much less progress on private sector deleveraging and the rapid pace of fiscal tightening. The increasingly robust UK economic recovery has benefited our markets, although balance growth remains substantially lower than pre-crisis rates, as shown in the chart below"	Unclassified
"Robust growth expected to continue in 2015With inflation low and deleveraging progressing at a manageable rate, UK economic growth is expected to continue at a similar rate in 2015 – the current consensus is 2.6 per cent, still above the economy’s long-term average growth rate of around 2.2 per cent (see chart below). Domestic demand will remain the driver, with households’ real income growth expected to benefit from higher earnings growth, falling unemployment and lower inflation, helped especially by the large fall in oil prices since the middle of 2014. We expect Bank Rate to begin to rise around the end of the year, for the first time in eight years, but the pace of increase is likely to be slow as responsiveness of the economy to interest rates normalises only gradually"	Unclassified
"As the economic recovery continues, we expect demand for credit from households and small and medium-sized businesses to rise, but growth is likely to stay well below pre-crisis rates as the appetite to borrow remains constrained by recent experience. With Bank Rate expected to rise only slowly, arrears are expected to remain low."	Unclassified
"Risks to the recovery remainAs the recovery continues, and adjustments in debt levels have progressed, the vulnerability of the economy to renewed weakening has reduced. Similarly, the outcome of the Scottish Referendum has removed a key source of near-term uncertainty for the economy and banks. However, with the General Election in May, political uncertainty remains high. The Eurozone remains a risk to the UK, not only because of its potential impact on UK growth, but also because of the financial market turbulence that would ensue if weak growth translates into election of political parties that favour Eurozone exit for some countries. Crystallisation of some of these risks could impact the UK economy significantly, which would in turn have a negative impact on the Group’s income, funding costs and impairment charges. Positively, the recent fall in oil prices, if sustained, will be a boost for global growth and could be particularly beneficial for Eurozone growth"	Unclassified
"Given our UK focus, our financial performance is inextricably linked to the performance of the UK economy and its regulatory and competitive environment."	Unclassified
	
"REGULATIONThe regulatory landscape is continuing to evolve with a greater focus on protecting consumers and small business customers through conduct and competition regulation, and on capital ratios, ring-fencing and resolution models through prudential regulation"	Unclassified
"Conduct and competition remains a focus for our regulators who have been carrying out reviews into the savings and credit cards markets alongside reviewing access to and ownership of payment systems. The Competition and Markets Authority (CMA) is also currently reviewing the UK SME and personal current account markets which will focus on competition, in particular barriers to entry and the ease of comparing and switching accounts."	Unclassified
"We are also continuing to work to ensure provision of appropriate and fair products for customers with clear, simple and relevant terms."	Social_Relationship
"New European Union legislation on capital ratios came into force in the UK on 1 January 2014. The Capital Requirements Directive IV (CRD IV) aims to ensure that firms hold enough financial resources to cover the risk associated with their business. The Basel Committee also continued to review its capital framework, including the consistency of Internal Ratings Based (IRB) models, standardised credit calculations and the capital requirements for operational risk. Other recent related capital regulation includes the UK leverage ratio framework announced by the Bank of England in October 2014. The Group has significantly strengthened its capital position in recent years and is now comfortably in excess of minimum requirements on both its CET1 ratio and its leverage ratio. The resilience of our capital position was demonstrated in 2014 when we exceeded the threshold for both the PRA and EBA stress tests. We will continue to be subject to these annual tests going forward."	Financial
"Ring-fencing and resolution regulation, through both the Financial Services (Banking Reform) Act 2013 and the European Commission’s Recovery and Resolution Directive, continues to be a focus. Banks will be required to ring-fence retail and SME activities from their investment banking activities to ensure consumers are protected. As a UK focused retail and commercial bank, most of our operations are expected to be within the ring-fence and therefore the impact is likely to be less than for many of our peers."	Unclassified
"We are assessing and implementing other regulatory changes including the Foreign Account Tax Compliance Act (FATCA), the UK’s Fair and Effective Markets Review, the Senior Managers’ Regime, and the Solvency II Directive, and will need to consider the legislation for the current EU parliament which is just beginning to be shaped by the new EU Commission. Overall however, we believe our simple, low risk, UK focused strategy puts us in a strong position to adapt to the ever evolving regulatory landscape"	Unclassified
"CUSTOMER DRIVERS AND COMPETITIONIn the competitive open markets in which we operate, customers are benefiting from an increasing range of products and services from a growing choice of providers and via a range of channels. The proportion of the UK population with access to the internet has increased significantly over the past few years, as has the proportion of people accessing the internet via their mobile phone. This has changed customer behaviours and expectations in terms of how they shop for goods and undertake banking and these trends are expected to continue"	Social_Relationship
"As outlined above, there are some clear customer trends emerging, but we recognise that every customer, whether an individual or an organisation, has particular needs and we must engage with them accordingly. Fundamentally, every customer has a choice and will select the provider that can most effectively fulfil their personal needs"	Social_Relationship
"Our new strategy, which focuses on our multi-channel distribution model, simpler processes, broad product reach and expertise across insurance and banking, puts us in a unique position to respond to these market conditions and meet the needs of individual and corporate customers. Above all it recognises that we operate in a competitive market where additional challengers continue to emerge and the only way of ensuring success is by focusing on the ever-changing needs of our customers. Read more about our new strategic priorities on page 20."	Intellectual
Key opportunities –  Economic environment: significant progress in reducing the Group’s risk profile and strengthening the balance sheet along with strategic actions taken in the last couple of years means we are better positioned to benefit as the economy recovers	Unclassified
"Customer needs: our differentiated customer focused strategy along with our comprehensive multi-channel distribution network, and in particular our evolving digital capability, mean we are well positioned to address changing customer needs."	Intellectual
"Regulatory environment: greater clarity emerging on regulatory requirements and our simple, low risk, UK focused strategy places  us in a strong position."	Unclassified
Low cost position: this enables us to provide competitive differentiation for the benefit of customers and shareholders	Intellectual
"Key challenges–  Economic environment: continuing economic uncertainty in the Eurozone.–  Regulatory environment: uncertainty remains around the implementation of key elements of the proposals on ring-fencing and the form of new legislation, especially that proposed by the new EU Commission"	Unclassified
Competition: an increasingly competitive market for lending and  deposits will potentially impact margins and require us to innovate  and evolve more quickly.–  Digital transformation: the pace of change is likely to be significant and  we will need to continue to invest to meet evolving customer needs.	Intellectual
	
Delivering for shareholders and customersOur key performance indicators are focused on strategic progress and how we are delivering for our customers and our shareholders.	Social_Relationship
"Over the past three years, we have made significant progress in each of these areas, delivered a significant improvement in financial performance and built a strong track record of delivery. It was this strong progress that allowed the UK government to start selling down its stake in the Group, beginning the process of returning the company to full private ownership at a profit for the UK taxpayer"	Financial
"Our key performance indicators have been considered by the Board and identify the most effective output measures for assessing progress towards becoming the best bank for customers and shareholders.We also track performance against the commitments of our Helping Britain Prosper Plan, the results of which can be found on page 24."	Social_Relationship
"Alignment of remuneration with performanceTo ensure our employees act in the best interests of customers and shareholders, remuneration at all levels of the organisation is aligned  to the strategic development and financial performance of the business and also takes into account specific risk management controls."	Unclassified
"Variable remuneration including bonuses for all staff, including our Executive Directors, is based on the performance of the individual, the business area and the Group as a whole. Performance is assessed against a balanced scorecard of objectives and reviewed on a regular basis, across five areas (customer, building the business, risk, people  and finance)."	Unclassified
"Executive management are also eligible to participate in a  Long-Term Incentive Plan, which encourages delivery on long-term financial objectives including total shareholder return and the Group’s strategic objectives of becoming the best bank for customers and helping Britain prosper."	Unclassified
	
"DELIVERING FOR SHAREHOLDERSAs a result of the strategic progress made, we reported improvements in underlying and statutory profit as well as a stronger capital position in 2014, despite legacy charges"	Financial
"UNDERLYING PROFIT  £mBEFORE TAX201320122014 7,7566,1662,5652011 429Earnings per share continued to improve given the increasing profitability of the business.  20132012 2014(1.2) 1.7(2.1) 2011(4.3)EARNINGS PER SHARE  pThe Lloyds share price fell by 4 per cent in 2014, and this was broadly in line with the FTSE 100 and ahead of the UK banking sector as a whole. Share price performance in the last three years remains significantly ahead of both the sector and the market. Total shareholder return was lower than the FTSE 100 in 2014 as the  Group did not pay a dividend.TOTAL SHAREHOLDER RETURN  %201320122014(4) 65 852011(61)Pre-tax statutory profit continued to recover and reached £1,762 million in 2014, compared to £415 million in 2013.  201320122014415 1,762(606)2011(3,751)STATUTORY PROFIT  £mBEFORE TAX Our cost:income ratio continued to fall in 2014 due to the continued focus on costs and increased income. The resulting cost leadership position provides competitive advantage for the Group.Excluding St. James’s Plac"	Financial
"DELIVERING FOR CUSTOMERSCustomer relationships are key to our strategy and are critical for all our businesses. Significant differences across our four divisions mean the financial and non-financial strategic indicators for the development of customer relationships are generally tracked at a divisional level.To assess progress, we measure customer satisfaction and are publicly committed to reducing complaints."	Social_Relationship
"Our net promoter score, which is the measure of customer service at key touch points and the likelihood of customers recommending us, improved in the year from 55 to 59."	Financial
	
"Our aim is to be the best bank for customers while providing strong and sustainable returns for shareholders.Customers are at the heart of everything we do, whether that be through our distribution network, our brands or our people. This commitment is supported by our Group  values of putting customers first, keeping  it simple and making a difference togethe"	Social_Relationship
"A broad multi-channel distribution network: branch, telephone and digita"	Intellectual
"Efficient systems and processes,  providing better customer experience  and cost leadership"	Intellectual
A range of iconic and distinctive brands	Intellectual
Relationship focus	Social_Relationship
Superior consumer insight	Social_Relationship
Using our cost advantage  for the benefit of customers	Intellectual
Engaged and customer focused colleagues	Social_Relationship
	
"Our business modelWe are a leading financial services group with a low cost, low risk, customer focused, UK retail and commercial banking business model. We provide a range of services, primarily in the UK, to individuals and commercial customers and by focusing on the needs of customers and operating sustainably and responsibly, we believe we will help Britain prosper and create value for our shareholders."	Social_Relationship
"We create value for our customers through our distinctive strengths, in particular our range of iconic and distinct brands, our superior customer insight, high quality, committed colleagues and relationship focus."	Social_Relationship
"The foundations for providing effective customer service are: our broad  multi-channel distribution network, our financial strength, our efficient systems and processes, and our UK focus. We want to meet our customers’ financial needs, help them succeed and create value for them"	Intellectual
"We offer simple, tailored products with innovation where it matters most to our customers across all our divisions. Our focus on creating a simpler, more efficient and agile organisation is enabling us to provide better product and service propositions, innovating as appropriate, to address customer needs at a fair price while delivering more efficient processes and improving our cost leadership position"	Intellectual
"The UK financial services market remains one of the largest in the world and, although our business model and strategy have been formulated in the context of a cautious outlook for the UK economy, we believe they remain appropriate for all stages of the economic cycle, whilst providing real differentiation and positioning us well for future regulatory reform"	Unclassified
	
We have achieved the strategic objectives we  set in 2011. Our focus  for the next three years  builds upon this  success with three  new strategic priorities.	Unclassified
"Our strategy Our low cost, low risk, customer focused, UK retail and commercial banking business model has driven the development of our new strategy. We have a number of distinct assets and capabilities, including our unique multi-brand, multi-channel model, our customer franchise, our market leading cost position, our proven management team and high quality committed people."	Intellectual
