Text	Theme
"Community Infrastructure Levy (CIL) CIL was intended to increase the transparency of development and replace the contributions currently made through s106 agreements. Take-up by local authorities has been slower than planned, and the CIL has proved complex in practice as the economics of local housing markets and site typologies vary widely. For example, an acceptable levy on a simple greenfield site may well prohibit development on a complex brownfield site. The CIL payment can also add significantly to upfront development costs making cash flow for smaller developers more challenging"	Unclassified
"Zero carbonThe Government maintains that it is committed to a zero carbon standard for all new homes  consented after 2016, but this target is very challenging given that policy-making is running well behind what would be considered a reasonable timeframe for the level of change the industry will face. Greater definition is needed quickly around Allowable Solutions (the likely regime for off-site carbon mitigation) and the related cost per tonne of carbon, which directly impact the design and carbon abatement cost of future homes. The Group continues to play an active part in zero carbon policy formation and remains focused on planning how it will meet  the Government’s carbon reduction timeline  and objectives"	Natural
"lood and Water Management Act 2010The Act provides for the management and reduction of flood risk associated with extreme weather. The Group complies with planning requirements to undertake a flood risk assessment and carry out mitigation measures in line with statutory requirements. A key area still to be enacted relates to adoption. Until the legislation is fully enacted in 2015 and responsibilities are clarified, ponds, swales and other forms of mitigation required by the Environment Agency are left unadopted by local authorities, leading to potential additional charges for home owners."	Unclassified
"60+ age groups: understanding the need for a product that is not sheltered (space, amenities, etc.).20+ age groups: developing our apartment designs.Volume products: new traditional and contemporary ranges on an increasing number of our larger sites  such as Oakgrove Village.Affordability and mobility: developing our suburban private rental sector offering"	Unclassified
Ageing populationPersonal wealth concentrated in  older groups. Household compositionA fifth of women and a third of men aged 20–34 live with their parents: up 40% since 2002. High proportion of people who cannot afford to buyAverage house price in England is around  5x average salar	Unclassified
"Labour leader Ed Miliband and his team selected our Oakgrove development in Milton Keynes as the launch venue for the party’s Housing Review. Prepared by Sir Michael Lyons, the report presents 39 recommendations on changes needed to increase housing provisio"	Unclassified
"One of the key themes is to further encourage local communities to bring forward more land for development in exchange for local residents being given priority rights to purchase the homes. With 81% of purchasers being drawn from MK postcodes and 51% of purchasers being first-time buyers, Oakgrove already showcases many of the Lyons Review principles"	Unclassified
	
"Dialogue and partneringCrest Nicholson engages and partners  with its stakeholders to balance needs and create value. We take a full role in supporting the development of housing policy in order  to increase the supply and affordability of  high quality, sustainable housing."	Intellectual
Masterplanning and consultation processes. ■ Research and product/service development. ■ Customer Charter and complaints handling	Intellectual
"Employee survey. ■ Ongoing engagement, e.g. meetings,  roadshows, intranet"	Human
Effective partnering to bring projects forward. ■ Land acquisition strategy balancing risk and reward	Unclassified
"Policy outworking and future policy – advice to Government and Department for Communities and Local Government. ■ Good design and sustainable development – Town and Country Planning Association (TCPA), Academy of Urbanism. ■ Low carbon – Homes and Communities Agency (HCA), UK Green Building Council, ZCH (including Group Technical and Quality Director secondment to the ZCH).  ■ Voice of the industry – HB"	Social_Relationship
AIMC4 research consortium supply  chain engagement. ■ Partnership approach to procurement and  project work. ■ Education and knowledge-sharing to increase  skills and capacity	Intellectual
"Effective partnering has been key to bringing forward Phase 1 of Tadpole Garden Village (see page 33) and also helped secure our appointment by the Defence Infrastructure Organisation as development managers for Arborfield Garrison in Berkshire and Wyton Airfield in Cambridgeshire. Both of these are significant public sector sites which in time will deliver 6,500 homes"	Unclassified
	
"n 2012, we consulted with stakeholders to identify topics of impact and importance, resulting in an initial list of material issues. This year, we reviewed and refined the list in consultation with a smaller representative group, which has resulted in the matrix  shown below"	Unclassified
"MethodologyUsing desk research and media scans we refined our 2012 list and invited stakeholders to comment on it as a whole, including rating each topic on a scale of 0 to 5 according to its impact on Crest Nicholson and its importance to stakeholders. As part of this process, structured  questionnaires and interviews were carried out with 14 of our managers/directors and 11 representatives from customer, partner and industry organisations. Their aggregated ratings informed the final selection of items and guided the positioning of each topic on the matrix, which is designed to be an at-a-glance summary of issues that are material to the Grou"	Social_Relationship
"Our risk register (see Principal risks and uncertainties, page 61), supported by this materiality analysis, has guided our decisions about which topics to include in our report and the levels of priority attached to these topics within the Group’s business strategy."	Unclassified
	
o grow the business to a level that sustains  long-term value creation for all our  stakeholders by delivering quality homes  that meet our customers’ need	Social_Relationship
"Managed  growth  of the business    Over the near to medium term, grow the business to its natural scale and at a level attuned to the cyclical housing market, through measured expansion in our existing  operating regions.     Over the longer term, focus on stability and maintaining  value creation"	Unclassified
"Skills and leadership    Develop a strong culture of organisational learning, build leadership capacity for the future"	Intellectual
"Delivering to customers  and communities    Meet the needs of our customers by creating high quality, well-designed homes and places that contribute to well-being and quality of life, and that deliver a lasting economic, social and environmental legacy."	Social_Relationship
"Partnership and  supply chain    Partner with landowners, government, our supply chain and other key stakeholders to bring forward sites and drive  efficient delivery."	Social_Relationship
Responsible resource  management    Operate our business and deliver our new homes and places in an environmentally responsible wa	Intellectual
	
"Reach £1bn of revenue within the next three years, with changes in the mix of product and locations driving the increase, along with growth in volumes"	Financial
Unit numbers. ■ Average selling price. ■ Sales revenue. ■ Operating margin. ■ Return on capital employed. ■ Earnings per share. ■ Land units and gross development valu	Financial
"Selectively growing the business and driving strong levels of earnings by adopting a disciplined approach  to returns.  S M L     Increasing outlet numbers within our existing areas of operation.  S M L     Developing additional revenue streams through a diversified portfolio, including targeting the private rental sector."	Financial
Maintaining managed and sustainable growth.	Intellectual
Looking to return cash to shareholders in favourable market conditions. S M L     Continue to review product range in light of changing demographics and financial status of core markets	Intellectual
	
Retain 5-star customer service rating. ■ Maintain 9 out of 10 for customer recommendation rating.  ■ HBF/NHBC customer service rating. ■ Customers recommending Crest Nicholson to a friend. ■ Proximity of developments to public transport and  local amenities.  ■ Qualitative data on public and green  open space. ■ Number of alternative management solutions. ■ Number of plots planned as  Garden Villages	Intellectual
Customer service affected by delays and/or quality issues. ■ Varied neighbourhood planning processes affecting delivery	Intellectual
"Staff and supply chain with strong design, production and consultation skills. ■ Quality procedures  and inspection"	Intellectual
"Our first neighbourhood plan in Henley. ■ Industry awards and benchmarks, e.g. Sustainable Housebuilder of the Year and Building for Life 12 (BfL12) at Bishop’s Brook, Wells. ■ Community Interest Company at Monksmoor Park"	Intellectual
"Apprentices to be  at least 10% of  employee base.  ■ % of vacancies filled by internal promotions.  ■ Number of apprentices.  ■ Number of graduates. ■ Training hours, total and by discipline. ■ Accident rat"	Human
Recruiting and retaining skilled staff in a  buoyant market	Human
Investment in training. ■ Investment in recruitment and employee engagement to increase capacity.  ■ Delivering Professional Excellence training. ■ Graduate training programme	Human
"Exploring  imaginative solutions for place making, building on our Garden Village principles and providing well-designed homes to meet the needs of different customer groups.  S M L     Creating great places that support sustainable lifestyles and well-being, with green open space,  good connectivity and accessible local infrastructure.  S M L     Maintaining excellent customer service and aftercare"	Social_Relationship
"Driving quality and value through high standards of design  and construction.  S M L     Consulting and engaging with local residents and stakeholders, enabling their full participation in neighbourhood plans and development proposals.  S M L     Developing innovative, affordable legacy solutions (e.g. Community Interest Companies) to help neighbourhoods grow and thrive."	Intellectual
"Establishing strong foundations for learning and continuous improvement within the organisation and supply chain.     S M L     Developing our workforce and leadership capacity through a focus on training and mentoring across the board, from management level to apprentice and graduate level. S M L     Showing leadership and driving improvement in health and safety.S M L     Embedding mechanisms for performance monitoring, feedback and learning to support  business improvement."	Human
	
"10% reduction in office energy and water use per person by the end of 2017.  ■ Reduce volume of waste produced per 1,000 square feet delivered by 10% by the end of 2015.  ■ % reduction in waste. ■ % homes built on brownfield land. ■ BREEAM Green  Guide rating. ■ % of sites with ecological enhancement"	Natural
"Policy changes and impacts, e.g. zero carbon timeline and adoption bodies within the Flood and Water Management Act. ■ European legislation. ■ Untested methods  of construction. ■ Uncertainty in scientific data on climate change. ■ Limited market for fossil-fuel alternatives"	Natural
Investment in innovation to deliver low carbon homes in line with  2016 timeline. ■ Partnering with suppliers and subcontractors. ■ Development plans and on-site staff and subcontractors to deliver Group-wide ecology and biodiversity framework.  ■ Our ‘Make Waste History’ campaign  and on-site waste reduction initiatives	Natural
"5% of directly supplied timber to be certified (FSC preferred) by 2016.  ■ % increase in  certified timber.       ■ Skills, labour and materials in short supply, affecting production.  ■ Management capability within the Group well matched to partnership requirements.     ■ Refreshed supplier partnerships and framework agreements to increase capacity"	Social_Relationship
"Reducing operational impacts in our main spheres of influence, focusing on carbon, waste, energy and water.S M L     Working with supply chain partners to eliminate high-risk materials and reduce fuel use on site. S M L     Adapting our products to a changing climate and developing masterplans that enhance local ecology and biodiversity.S M L     Building our evidence base to understand lifestyle and behaviour impacts on the performance and carbon footprint of our new homes"	Natural
"Working in partnership with landowners and government to maintain a land pipeline for both short-term and long-term  housing delivery.S M L     Working with our supply chain and subcontractors to innovate and improve build standards, materials and sustainable sourcing. S M L     Developing innovative, mutually beneficial relationships with suppliers and partners to secure labour, skills and materials,  to build capacity and ensure  quality construction.S M L     Exploring the potential for more off-site, fast-track construction for improved efficiency"	Social_Relationship
	
	
"Strong delivery performanceStrategically positioned for the future>16% £9.3bn£536.5m £287,000increase in housing  unit completionsNew Chiltern  division launched.Increased  volumesExpand business towards natural scale Strong growth in  net asset valuePortfolio quality  and range Long land  pipelineNew revenue streams Average open-market selling priceAttractive returns"	Financial
Earnings per share:  39.3 pence – up 34%.Return on capital employed: 26.0% – up 190 basis points	Financial
"Consider opportunities to expand the business.        Examine options in relation to the private rental sector.      Continue to research and understand customers’ needs, ensuring that our product range and market positioning address emerging trends"	Intellectual
	
"Increasing delivery of affordable homesThis year the Group delivered 2,530 new homes (housing legal completions), up 16.5% on the prior year. 203 Build to Rent homes were contracted and are in delivery"	Unclassified
"Selective additions have been made to the short-term land pipeline, which has increased the gross development value of the housing portfolio by 23% to £4,798m, reflecting the investment in strong locations with higher average selling prices (ASPs"	Manufactured
"In the year to date, 19 new sites and 2,173 plots have been acquired, along with a further six sites and 1,587 plots, which have been converted from the strategic land portfolio over the same perio"	Manufactured
"At 5th September 2014, all land required to meet our 2015 forecasts had been secured with planning in place; land for 2016 unit delivery was also wholly secured, mostly with planning. As a result, the volume and ASP projections in our medium term forecasts are significantly underpinned, in line with guidance provided at the time of our half-year announcemen"	Unclassified
"Our strategic land pipeline continues to develop, increasing by 1,894 plots in the year to date, net of the impact of transfers and re-plans. Of a total of 16,219 strategic plots, over 50% are allocated within a Local Plan or included in a draft allocation. Four other strategic sites had planning applications submitted within the year.Our healthy land pipelines enable the Group to maintain its focus on investing in opportunities that deliver attractive financial returns. Hurdle rates for new land acquisitions have recently been increased in support of this objective."	Financial
	
"Balanced growth: our new divisionThe Group’s new Chiltern division, based in  St Albans, Hertfordshire, opened for business at the end of the financial year. The new division has been pump-primed with a number of operational sites, as well as securing its own new projects and will provide additional management bandwidth to support outlet growth in 2015"	Unclassified
"Looking forwardThe fundamentals of the housing market are sound, aided by economic recovery, mortgage access and Government support through Help to Buy, with interest rate movements unlikely to derail momentum. Improving the supply of consented land underpins our strategy of managed growth and Crest Nicholson is well positioned to deliver stretching but achievable ambitions for the next three years"	Unclassified
"Visionary new development with community at its heart: Tadpole Garden Village, Swindon  Tadpole Garden Village is one of the first developments of its kind in the country and showcases the benefits of low-density family housing using Garden Village principles updated for today’s need"	Unclassified
"Our vision for a distinct community-  An innovative development of nearly 1,700 homes set within  179 hectares of countryside and green open space. -  Community infrastructure to include a primary school, shops, playing fields, community building and surgeries. -  Phase 1 Tadpole Gate to comprise 97 high specification houses. -  Phase 2 homes in Arts and Crafts style set in tree-lined avenues  and linked by pedestrian and  cycle networks.-  Comprehensive ecology plans, include retaining hedgerows and trees and more significant green open areas along site boundaries"	Intellectual
"Creating a legacy to be proud ofImaginative design and a harmonious mix of homes, open space, social space and architecture will help to set new benchmarks in design, community life and infrastructure. A sense of ownership, responsibility and civic pride will also come from the close involvement of community groups and partners. A Community Investment Company has been  set up to provide a mechanism  for affordable, long-term management of the green spaces and public realm."	Intellectual
"Delivering a new schoolWe have helped Swindon Borough Council overcome a local shortage of primary school spaces by providing early access to the school site on the development. The new school, Tadpole Academy, is due to open by September 2015 but is currently being run from the nearby Red House Community Centre. Prior to term starting, we provided the school with access to a commercial unit for the running of some summer classe"	Unclassified
	
Design reviews and build quality inspections strengthened	Intellectual
"Customer satisfactionDesign and quality AwardsStrategic workstreams Product development Traditional and contemporary housing ranges added to portfolio. Delivered our first Code 5  low carbon home.Major awards for sustainable house building, place making  and regeneration.Developed initial two-year action plans and secured capital budget for workstreams on product developme"	Intellectual
Meet and anticipate market trends.    Raise our customer satisfaction rating from  4-star to 5-star.      Launch strategic workstreams on product development (responding to trends and future needs) and creating great places as part of our 10-year sustainable business strateg	Intellectual
	
"Customer satisfaction and serviceOne of the Board’s focus areas has been to regain a 5-star customer satisfaction rating in the HBF industry survey and we were pleased to achieve this during the year. Having said this, there is no room for complacency and we are working hard to maintain and raise our scores"	Social_Relationship
"Driving quality in product, service  and aftercareAt the same time as increasing housing supply, we must continue to deliver homes that meet customers’ expectations for outstanding quality of finish. This was a clear challenge this year and supply chain pressures also led to some delays in delivering on time to our customers, which may well be reflected in next year’s customer satisfaction rating"	Intellectual
"We are working hard to address areas of concern to our customers. We have strengthened our quality assurance processes, including specifying a standard above the industry norm for paintwork, and have  improved our Quality Manual (see page 53)  so it clearly sets out the standards we expect  of our subcontractors"	Intellectual
"nhanced internal reporting and more regular communication between customer service and production teams are also part of our drive to ensure fast, effective resolution. Our customers can raise any issues with us through a dedicated phone service manned 24 hours a day."	Intellectual
The buying process was absolutely great. The home demonstration where they explained all the features of the house was a real added bonus. We felt fully supported through the entire process	Unclassified
	
"Where people really want to liveBuilding a new generation of garden cities enjoys cross-party support, in recognition of the importance of addressing Britain’s chronic housing crisis. We have continued to evolve our Garden Village concept in partnership with stakeholders and are now seeing the principles come to life on larger strategic sites like Tadpole Farm, which we were delighted to launch this year as the first Crest Nicholson Garden Village (see case study, page 33)"	Social_Relationship
"One of the Group’s contributions this year to the public debate about meeting housing need was to support the creation of the Garden Cities Myth-Buster, a research-based guide published by the TCPA that aims to offer clarity around some common misconceptions, such as land use."	Unclassified
"As the guide explains, decisions about where to build the homes that people need is not a question of using either greenfield or brownfield land but a matter of choosing the most sustainable locations for new and renewed communities, based on a wide range of economic, social and environmental factors. This is borne out in our Garden Village principles, which are designed to be equally applicable to our greenfield and brownfield developments, and work at many scales  and densities"	Social_Relationship
"Where quality and good design go togetherWe have continued to focus on improving designs, processes and quality, factoring in external drivers such as building regulations and emerging housing standards:"	Intellectual
Building for Life 12  – these widely recognised principles remain our key benchmark for assessing good design.  ■ Space   – Government is consulting on a national space standard. We continue to develop our house designs and have already increased the size of our two- and three-bed units.  ■ Design appraisals   – we carry out formal design reviews and  sign-offs at every key stage to maintain the integrity of the design conce	Intellectual
"Reviewing our house designs for the future  – over 82% of our short-term portfolio  (c.15,000 homes) is bespoke product, with less than 18% using ‘standard’ or ‘modified standard’ house types. We are exploring this balance to ensure we design and deliver the right product for the right development."	Intellectual
Landscape design  – we have improved our approach with  much earlier involvement from  landscape architects.	Intellectual
	
"InfrastructureProvision of infrastructure for the community, including schools, leisure, technology, affordable homes and community buildings. Healthy livingOpportunities for healthy living and personal well-being for people of all ages through growing food and gardening, walking and cycling, children’s play  and sport. Travel choicesTravel choices and good connections to jobs, services and facilities on site and in the wider community, and the natural environmen"	Social_Relationship
"Long-term managementLong-term management  of high quality green  spaces and public realm  for the community.TechnologyThe use of technology  for promoting awareness  of community events  and lifestyle choices.Civic prideInvestment in the  community to encourage  a sense of ownership, responsibility and civic  pride through community groups and buildings, and partner involvement"	Social_Relationship
"Street sceneFocus on the importance of the street scene through attractive buildings, public art, street furniture,  the use of materials, strong landscaping and  tree-lined streets."	Social_Relationship
Quality designLandscape-led masterplanning and high quality design incorporating homes with landscaped front gardens and on-plot parking	Intellectual
"Well connectedNeighbourhoods that are easy to understand and move around, with a wide range of interlinked uses and generous green spaces"	Social_Relationship
	
"Where great, low impact homes come  as standard Applying our learning from the AIMC4 project, we have made improvements to our building fabric, including thicker insulation in wall cavities, improved specification of windows and reduced thermal bridging to minimise heat loss"	Intellectual
"This ‘fabric first’ approach has advantages over the use of renewables, including less maintenance or complication for our customers, since the building’s fabric lasts for the lifetime of the home, which may not be the case for renewable energy technologies or their components. One result is that fewer of the homes we built this year had renewable or low carbon energy sources (28% of all our new homes in 2014 compared to 42% last year"	Intellectual
"Crest Nicholson’s new homes deliver excellent energy performance, reflected in our high Standard Assessment Procedure (SAP) rating (an average of 83.96 out of 100) – which has continued to improve and continues to outperform the national average for new homes (81.5 out of 100)"	Intellectual
