Text	Theme
"Who we areCrest Nicholson has been building high quality new homes and creating great places for 50 years and is a leading developer with a passion  not just for delivering homes but  also for establishing vibrant, sustainable communities"	Social_Relationship
What we deliverOur portfolio includes design-led housing developments and large-scale urban regeneration schemes with a blend of residential and  commercial use	Intellectual
"How we deliverWe aim to deliver excellent, innovative design, high levels of customer  service and quality development  that creates sustainable value in  local communities"	Intellectual
"Our mission Crest Nicholson’s driving ambition is to be the market leader in the design and delivery of sustainable housing and mixed use communities. We aim to improve the quality of life for individuals and communities, now and in the future, by providing better homes, workplaces, retail and leisure spaces where people want to live, work and pl"	Social_Relationship
	
"Experienced management, nurturing talent and developing long-term partnerships   to deliver sustainable resultsResources and relationships we rely on"	Social_Relationship
Financial resources  – working capital and a healthy balance shee	Financial
Natural resources  – land and materials to build with. The Group’s long and well-located land pipeline  is a key asset	Manufactured
"Factors influencing our business modelWe keep our business model under review in response to external factors such as changing government policy, market trends and evolving regulation. For example, the planning system is a major factor in the cost and complexity  of development and can add to the length of time that elapses before a site becomes revenue-generating. Throughout this report we discuss such external factors in more detail"	Unclassified
Revenue – our main revenue stream is the sale of new homes to private individuals and institutions such as housing associations	Financial
"Jobs – we generate jobs during construction, and there are also local economic benefits for the wider community from development"	Social_Relationship
"Community benefits – development activity contributes to new social  infrastructure, including schools, medical surgeries, neighbourhood centres and sports facilities.  Enhanced local environments – through ecologically sensitive development, we aim to  enhance open green space  and natural habita"	Social_Relationship
Meeting our customers’ needs for homes and places that people really want to live in. Offering experienced support and buying advice throughout the house buying process.Providing the best possible customer experience  from initial contact to aftercare	Social_Relationship
"hampioning best practice and driving high standards in quality of build. Well-managed sites leading the industry in considerate construction, health and safety, and waste management.Working with our supply chain to build long-term relationships that deliver value."	Social_Relationship
"Expertise and partnership skills to achieve even the most complex of planning consents, with and for local stakeholders. Creating vibrant communities with a high quality blend of product and tenure.Outstanding masterplans including supporting social infrastructure and public realm"	Social_Relationship
"High quality, diverse and well-located land portfolio  in the southern half of the UK"	Intellectual
Expert knowledge and skills in bringing land forward  to successful planning outcomes	Human
Well-constructed strategic land pipeline adding  to our sustainable land supply	Manufactured
"nnovative infrastructure to support the creation of new communities, e.g. Community Interest Companies to own and manage communal assets.Enduring and affordable management solutions that help secure the long-term future of the places we create.Providing financial contributions to the adoption of local public infrastructur"	Manufactured
	
"The Group’s core operations are focused on the southern half of the UK with an emphasis on creating high quality, well-designed homes and sustainable communities. Combined with a significant land pipeline, our southern bias provides a distinctive offer among the listed house builders. Our diverse portfolio meets the needs of a wide range of purchasers, from first-time buyers to investors, with a bespoke product range that includes a mix of apartments and houses, ranging from  one-bedroom apartments to five-bedroom detached homes"	Unclassified
	
"kills and experience, a scalable, regional delivery model and local knowledge keep us attuned to the needs of communities and ensure that our developments remain sensitive to their individual surroundings"	Intellectual
"Major Projects Division (Crest Nicholson Regeneration) – specialising in larger-scale partnership developments with public and private vendors, including residential and mixed use schemes. ■ Strategic Land Division (Crest Strategic Projects) – focusing on sourcing unallocated sites for medium to long-term development by the Group’s other divisions"	Intellectual
Regional  house building  divisionsEastern   South  South West   Chiltern   London Major Projects  Division Crest Nicholson Regeneration Strategic Land  DivisionCrest Strategic  Pro	Unclassified
"Housebuilder Awards 2014 ■ Sustainable Housebuilder  of the Year. ■ Housebuilder of the Year (Large). ■ Best Regeneration Project for Park Central.British Homes Awards 2014 ■ Homebuilder of the Year.Housing Designer Awards 2014 ■ Bath Riverside, winner in the completed schemes category  and project categor"	Social_Relationship
"NextGeneration Gold Award for sustainability leadership ■ Second out of 25 top house builders with a score of 82%  (all-company average: 34%).NHBC Awards: Health and Safety and Pride in the Job ■ Our site managers won several Regional and National Awards for health and safety, and we also had 12 Quality Award winner"	Social_Relationship
Strategic report Corporate governance Financial statements 13Crest Nicholson  Annual integrated report 2014 21  Our changing landscape 24  Dialogue and partnering 26  Strategy31  Performance 56  Key performance indicators59  Governance and leadership61  Principal risks and uncertainties64   Finance Director’s review	Unclassified
	
"The Group’s results show that it has once again been proactive and effective in bringing forward new homes and new communities to meet this need: in 2014 delivering 2,530 new homes – a significant uplift on the prior year – and increasing operating profits by more than 30%  to £128.1m"	Financial
"The Help to Buy shared equity scheme has played an important role in helping primarily first-time buyers onto the property ladder, providing access to more affordable mortgages and in turn supporting much-needed  housing delivery"	Financial
"n another significant year for the Group, we have seen record financial results achieved through delivering quality and excellence in a market buoyed by strong demand"	Financial
A continuing focus on the southern half of the UK and investment in quality locations where the economy is strong and average selling prices are higher remains the Group’s proven strategy for driving value and providing consistently attractive returns to its shareholders.	Financial
"Having regard to the Group’s financial position and trading prospects over the medium term, the Board proposes a final dividend of  10.2 pence per share (2013: 6.5 pence). The dividend is covered 2.75x by earnings. As the business matures in scale, the Board believes that a progressive reduction in the level of dividend cover, towards 2.0x earnings, would  be appropriate"	Unclassified
"The Group aims to create the widest possible value through its sustainable business model, which balances environmental and social drivers alongside economic ones. Allied to its excellent delivery capability and distinctive proposition focused on customer needs, high quality design and sustainable legacy, this positions the Group well in its markets, maintaining it on a path of well-managed gro"	Intellectual
I am confident that the Board’s experience and knowledge provide the necessary support and direction for the Group to continue delivering long-term value creation for all our stakeholders.	Human
he Group’s consolidated profit after taxation  (pre-exceptional costs) for the financial year ending  31st October 2014 was £98.8m (2013: £71.5m)	Financial
"The Directors propose to pay a dividend of 10.2 pence for the year ended 31st October 2014, which, together with the interim dividend of 4.1 pence per share paid in October 2014, brings the total dividends in the year to 14.3 pence (2013: 6.5 pence)"	Unclassified
	
"There are of course challenges to be managed and, in today’s rising market, the Board is well aware of potential impacts in an industry that relies heavily on the labour, skills and workmanship of our subcontractors to build new homes of quality. The Board is also alert to potential economic uncertainty both in the UK and globally, and potential changes to the political landscape in the wake of the General Election in 2015"	Human
"remain confident, however, that the Board’s experience and knowledge provide the necessary support and direction for the Group to continue delivering long-term value creation for all our stakeholders"	Human
"We look forward to maintaining a strong operational and financial performance in 2015, buoyed by healthy indications for consumer sentiment and mortgage availability. Recent changes to the stamp duty system will also undoubtedly boost activity by removing a degree of consumer uncertainty and helping to solve the affordability challenge so many purchasers are facing."	Unclassified
Without a talented workforce none of this would be possible and I would like to thank the Board and all employees most sincerely for their dedicated and professional contribution to a year of record achievement.	Human
"Strategy testing, including risk scenarios, competitive positioning and 10-year sustainable business model  ■ Development of opportunities, including a new division and further engagement with the private rental sector"	Unclassified
"uccession planning, skills and leadership development, including increased focus on diversity"	Human
"Oversight of plans and performance in customer service, quality standards and product innovatio"	Intellectual
"The Oaks, in the sought-after location of East Grinstead, offers a sensitively designed collection of three-bedroom cottages and four- and five-bedroom family homes, all set within  established woodland"	Unclassified
	
	
"Wholehearted thanks to all our employees who have been instrumental in these results. They bring their expertise to everything we do – working effectively with partners to create masterplans, homes and places that reflect our ambition to provide our customers with high levels of quality and service, good design and sustainable outcomes"	Intellectual
"To name just a few highlights, I was delighted with progress at Swindon this year where we have been working with local authorities to deliver the first implementation of a Crest Nicholson Garden Village. Tadpole Garden Village is one of the first developments of its kind in the country and an exemplar of the benefits of low-density family housing. Our work there this year included speedily delivering a fully functioning temporary school, which is serving local needs while we go about creating the permanent facilitie"	Unclassified
I am delighted to report that the Group has produced another excellent financial performance in a buoyant housing market in which we focused on bringing forward additional new homes to increase  housing supply	Financial
"Meanwhile, our Oakgrove development in Milton Keynes was chosen as the location for the launch of the Labour Party’s Lyons Housing Review. Being delivered through a public–private sector partnership and having achieved an average of two sales per week over the last 18 months – over 80% of them to MK postcode buyers – Oakgrove illustrates how development can meet the housing needs of an existing community"	Intellectual
Sensitive design and place making can also restore pride to inner city areas and nowhere shows this better than Park Central in the heart of Birmingham. Park Central was judged Best Regeneration Project in the 2014 Housebuilder Awards and we were equally delighted to be judged Sustainable Housebuilder of the Year and Large Housebuilder of the Year in 2014	Intellectual
16.5% increase in housing unit completions. ■ Forward sales up 8.4%. ■ Earnings per share up 34%	Financial
nvestment in strong locations with higher average selling prices delivering attractive returns. ■ 23% increase in land Gross Development Value. ■ More than 50% of strategic land is well advanced  in the planning process (within local plan or  draft allocation)	Financial
Materials in short supply and extreme rainfall led to some unavoidable delays on our sites.	Unclassified
"aunch of new Chiltern division, providing additional management capacity to support outlet growth"	Intellectual
	
"The Group contributes to housing supply through the efficient delivery of sustainable homes and communities, while continuing to pursue imaginative, innovative urban design solutions and ways to build well. We also provide support for policy and standards development through our involvement with organisations and groups including the Zero Carbon Hub (ZCH)"	Intellectual
"Nevertheless, a severe housing shortage continues to exist, especially in the south-east  of England. Political leadership over the long term will be key to doubling provision from current levels of around 120,000 new homes  a year to the desired level of 243,000 a year –  a major challenge for policymakers, authorities and industry"	Unclassified
"Early in 2013, some of the pent-up demand was satisfied through the Government’s Help to Buy scheme, which rejuvenated the mortgage market and saw increasing numbers of first-time buyers able to access finance – a trend which continued into 2014"	Unclassified
"he surge in demand was not without consequences and like the rest of the sector we had to deal with a shortage of bricks, blocks and other materials as suppliers struggled to respond to increasing levels of output. Despite going outside our traditional UK supply base to overcome this, our schedules suffered and were also interrupted by a long period of extremely wet weather in some of our regions."	Unclassified
We were pleased to regain our 5-star rating for customer satisfaction this year. We are working hard to maintain it although we recognise that this may be affected by negative feedback from some customers who unfortunately had to wait for their new home due to inclement weather and shortages in the supply chain.	Social_Relationship
"Every customer expects their new home to be built well, finished to the highest quality and delivered free of defects. These are equal priorities for the business too and the focus on increasing housing supply must not divert from the challenge of improving construction standards, driving quality through our product and providing high levels of customer care"	Intellectual
"Upskilling and developing our workforceA sustainable supply of materials is of course critical to the construction sector but delivering high quality, low carbon new homes also calls for expertise and knowledge, of which the industry is short."	Intellectual
"It is not just construction skills we depend on but the broader communication skills essential for bringing new development forward to planning consent.To help address the skills gap across the industry we are developing our own workforce and this year have significantly increased investment in training and career development at all levels. Among several initiatives underway are programmes in Management Excellence, Sales Excellence and Executive Coaching"	Human
	
"We are also working to increase practical knowledge and skills on our sites through our new Quality Manual and inspection processes. These are designed to promote good workmanship and prevent poor practices such as substitution of materials, which can contribute to the performance gap between design and as-built. Reflecting the importance we place on all these areas, during the year  we created a Group Training function with  two dedicated roles to provide central  direction and suppor"	Human
"The drive to attract, retain and develop promising talent is why we have significantly strengthened our graduate programme, including forming strategic links with selected universities so we are able to better identify and engage high quality candidates. Apprentices are just as vital and we have continued to put time and resources into our well-established scheme, which follows the Construction Industry Joint Council guideline for apprentice pay and is set above the minimum wag"	Human
"s the Board Director with overall responsibility for health and safety I am pleased to report that we achieved a lower accident rate compared to last year. However, our rate rose above our peer group and the construction sector and there will be no let-up in our efforts to improve. We have made a further appointment to the Group Health, Safety and Environmental (HSE) function and also saw a 40% increase in safety training days delivered this yea"	Human
"Along with safe working practices, good environmental practice is a key priority. The rate of conformity our developments are achieving against our site environmental standards continues to improve"	Natural
	
"The Group is in good shape to leverage its core strengths in land and planning, design and delivery – enabling it to make the most of opportunities for managed expansion"	Intellectual
"Our new Chiltern division illustrates this growth strategy. Launched at the end of the financial year, our new division will support more effective business activity within our existing geography"	Unclassified
We anticipate that the supply/demand imbalance in housing will continue and the Group will play its part in increasing housing volumes through selective acquisition of well-located sites to replenish our land pipeline and by bringing residential and mixed use developments forward in a sustainable manner.	Unclassified
"Over the longer term, we are putting our 10-year sustainable business roadmap into action, which includes a review of our product portfolio. We are also developing our offering with a view to capitalising on market opportunities targeted to different customer groups, including those in the private rental secto"	Unclassified
"Feeding into our 10-year roadmap we have put in place customer-focused workstreams addressing many different aspects, including environmental challenges. By continuing to innovate with our partners and the supply chain, we will play our part in achieving growth within environmental limits, especially given the natural resource and supply constraints we all operate under. Our strong focus on sustainability will continue both through our product and our operations; we aim to maintain our sector leadership in this area and will continue to maintain our performance in the NextGeneration benchmark and FTSE4Good indice"	Social_Relationship
"We will continue to invest in creating a workplace where people can excel and focus on developing talented people to lead the Group’s future. For this reason especially, I look forward with confidence and a real sense of anticipation to the next stages of Crest Nicholson’s journe"	Human
	
"Figures released by the Home Builders Federation (HBF) as of September 2014 showed very positive indicators of current and future house building activity compared to the last few years, with indicators suggesting increases in the region of 25% – the steepest rate of growth in 40 years. However, the number of housing starts is still far short of the levels requir"	Unclassified
"The strong demand for new homes was evident throughout 2014, particularly from first-time buyers who were supported with increased access to finance through the Government’s Help to Buy equity loan scheme, which stimulated mortgage provision and the wider housing marke"	Financial
"Sales levels moderated slightly in the latter part of 2014, due in part to tighter affordability stress tests and other responsible lending criteria which came into force from April onwards following the Mortgage Market Review. Sales volumes have now settled into a more normal seasonal pattern, with a good overall reservation rate being achieved"	Financial
"Housing market outlookThe Board is aware of and monitors macro-economic risks including UK, Eurozone and global impacts (see Principal risks and uncertainties, page 61). Notwithstanding these, prospects for the housing market are favourable, helped by cross-party support for new housing delivery, good mortgage access, improved consumer confidence, recent changes to the SDLT (stamp duty) regime and ongoing economic recovery – although market activity may be affected  by purchaser uncertainty over potential policy changes in the wake of a  General Election"	Unclassified
"The Group has very few homes in its development pipeline that would be expected to sell for values in excess of £2m and therefore does not anticipate any adverse impact from  the possible introduction of a ‘mansion tax’ at that level.The main constraints on volume delivery and growth relate to supply chain/production capacity (materials, labour, skills) and the clearance of sometimes onerous planning conditions to allow site starts"	Unclassified
	
"However, the Group’s rate of sale (significantly above historical norms), a plentiful land supply with plots being drawn from both short-term and strategic land pipelines, and sales prices offsetting pressures from rising build and materials costs are all positive indicators for the next trading year."	Financial
Commercial/mixed use The Group retains in-house commercial and mixed use development skills to design and deliver the supporting mixed uses on its larger developments and the ground floor commercial uses on its town and city centre apartment blocks. The value of this activity taken together with revenue from residential land sales will not usually exceed 10% of Group revenues	Intellectual
"Milestones achieved during the year include the letting and sale of the final part of the District Centre at Oakgrove, Milton Keynes; a significant new Morrisons food store at Centenary Quay, Southampton; and consent for the first 200 homes and a significant new business park at Longcross near Chobham, Surrey"	Manufactured
"PlanningThe planning regime has a major impact on the location, form, scale and rate at which new housing sites can be brought forward. The Government’s National Planning Policy Framework (NPPF), published two years ago to streamline and improve the planning system, is now beginning to take effect. Approximately 230,000 houses were consented in England  in the last 12 months: a rate not achieved  since 2007"	Unclassified
"Despite this, the rise in the rate of consents is lowest in the South East and the number of consented sites (rather than plots) remains low"	Unclassified
his is not necessarily helpful to either house builders or policymakers as most demand remains in the South East and overall delivery is determined by the number of housing outlets rather than the number of consented plots	Unclassified
The NPPF provides a framework for community focused plans in the form of neighbourhood planning but there are challenges affecting delivery and viability. The ongoing delays with many Local Plans makes their relationship to neighbourhood plans difficult to manage but our planning teams are continuing to develop their approach and we remain committed to genuine local engagemen	Social_Relationship
"Overall, planning remains a significant entry barrier to the house building industry in terms of time, cost and complexity. This is a huge challenge to policymakers as, without an increase in the small and medium-sized enterprises (SME) sector (which has reduced from 12,000 companies to about 3,000 over the last 25 years), housing delivery will continue to fail to meet demand. The Group remains strongly focused on increasing the supply and value of its short- and long-term development pipeline and most of its land for 2015 and 2016 housing delivery is already permissioned"	Unclassified
The red tape challenge and the desire to remove impediments to housing delivery has prompted the Coalition Government to try to streamline regulation in several areas	Unclassified
"Housing standardsThe Government is consulting to harmonise and reduce the number of different local standards that councils apply. Space is one such area and Crest Nicholson would welcome harmonisation even at the larger sizes proposed, as long as there is an adequate transition process. However, it should also be recognised that meeting a higher national space standard could impact affordability and viability in some lower value parts of the country"	Unclassified
"On a visit to our Centenary Quay development in Southampton, Chancellor of the Exchequer George Osborne met first-time buyer Stephen Bennett, who is stepping onto the housing ladder via the Government’s Help to Buy scheme. 72% of all our Help to Buy sales this year were to first-time buyers"	Unclassified
	
